user_id,status_id,created_at,screen_name,text,source,display_text_width,reply_to_status_id,reply_to_user_id,reply_to_screen_name,is_quote,is_retweet,favorite_count,retweet_count,hashtags,symbols,urls_url,urls_t.co,urls_expanded_url,media_url,media_t.co,media_expanded_url,media_type,ext_media_url,ext_media_t.co,ext_media_expanded_url,ext_media_type,mentions_user_id,mentions_screen_name,lang,quoted_status_id,quoted_text,quoted_created_at,quoted_source,quoted_favorite_count,quoted_retweet_count,quoted_user_id,quoted_screen_name,quoted_name,quoted_followers_count,quoted_friends_count,quoted_statuses_count,quoted_location,quoted_description,quoted_verified,retweet_status_id,retweet_text,retweet_created_at,retweet_source,retweet_favorite_count,retweet_retweet_count,retweet_user_id,retweet_screen_name,retweet_name,retweet_followers_count,retweet_friends_count,retweet_statuses_count,retweet_location,retweet_description,retweet_verified,place_url,place_name,place_full_name,place_type,country,country_code,geo_coords,coords_coords,bbox_coords,status_url,name,location,description,url,protected,followers_count,friends_count,listed_count,statuses_count,favourites_count,account_created_at,verified,profile_url,profile_expanded_url,account_lang,profile_banner_url,profile_background_url,profile_image_url
818649862967177216,1064649630842003457,2018-11-19T22:40:26Z,DeniseforAR,"@cupcakesarenice I’m still using Denise@DeniseGarner.com, but will be getting an official House email in Dec. I think it’ll be Denise.Garner@arkansashouse.org",Twitter for iPhone,141,1064582814807543812,22165125,cupcakesarenice,FALSE,FALSE,0,0,,,,,,,,,,,,,,22165125,cupcakesarenice,en,,,,,,,,,,,,,,,,,,,,,,,,,,,,,,,,,,,,,|,|,|||||||,https://twitter.com/DeniseforAR/status/1064649630842003457,Denise Garner,"Arkansas, USA","Retired Oncology Nurse, nonprofit founder, mother & grandma. Representative for Arkansas District 84. #Denisefor84",https://t.co/1hsAOCNvfd,FALSE,1844,725,27,764,3386,2017-01-10T02:45:11Z,FALSE,https://t.co/1hsAOCNvfd,http://denisegarner.com,en,https://pbs.twimg.com/profile_banners/818649862967177216/1514915839,http://abs.twimg.com/images/themes/theme1/bg.png,http://pbs.twimg.com/profile_images/818887155338674176/CBrdC3Ts_normal.jpg
818649862967177216,1061780931319619587,2018-11-12T00:41:15Z,DeniseforAR,"You all know about Lucy McBath's amazing win on Tuesday. Her @MomsDemand colleagues are so proud of her. But did you know that 16 other Moms Demand Action volunteers and gun violence survivors from our organization won their races, too? Here's a little more about each of them.",Twitter for iPhone,140,,,,FALSE,TRUE,0,1942,,,,,,,,,,,,,,246939630|1017637447,shannonrwatts|MomsDemand,en,,,,,,,,,,,,,,,,1061652401835233280,"You all know about Lucy McBath's amazing win on Tuesday. Her @MomsDemand colleagues are so proud of her. But did you know that 16 other Moms Demand Action volunteers and gun violence survivors from our organization won their races, too? Here's a little more about each of them.",2018-11-11T16:10:31Z,Twitter Web Client,7282,1942,246939630,shannonrwatts,Shannon Watts,291916,8613,100711,"","Founder of @MomsDemand, grassroots army of @Everytown fighting to end gun violence. Working to elect women. Rated Fx by the NRA since 2012. Book out May 2019.",TRUE,,,,,,,|,|,|||||||,https://twitter.com/DeniseforAR/status/1061780931319619587,Denise Garner,"Arkansas, USA","Retired Oncology Nurse, nonprofit founder, mother & grandma. Representative for Arkansas District 84. #Denisefor84",https://t.co/1hsAOCNvfd,FALSE,1844,725,27,764,3386,2017-01-10T02:45:11Z,FALSE,https://t.co/1hsAOCNvfd,http://denisegarner.com,en,https://pbs.twimg.com/profile_banners/818649862967177216/1514915839,http://abs.twimg.com/images/themes/theme1/bg.png,http://pbs.twimg.com/profile_images/818887155338674176/CBrdC3Ts_normal.jpg
818649862967177216,1061471403592110080,2018-11-11T04:11:18Z,DeniseforAR,Honored &amp; excited to serve with these passionate Democratic Reps in the #arleg https://t.co/w8TGChOhs4,Twitter for Android,82,,,,FALSE,FALSE,126,14,arleg,,,,,http://pbs.twimg.com/media/Drsak8KU8AA5JC6.jpg,https://t.co/w8TGChOhs4,https://twitter.com/DeniseforAR/status/1061471403592110080/photo/1,photo,http://pbs.twimg.com/media/Drsak8KU8AA5JC6.jpg|http://pbs.twimg.com/media/DrsamW8UUAEL85k.jpg,https://t.co/w8TGChOhs4|https://t.co/w8TGChOhs4,https://twitter.com/DeniseforAR/status/1061471403592110080/photo/1|https://twitter.com/DeniseforAR/status/1061471403592110080/photo/1,,,,en,,,,,,,,,,,,,,,,,,,,,,,,,,,,,,,https://api.twitter.com/1.1/geo/id/274ce42386dde428.json,Cordova,"Cordova, Memphis",neighborhood,United States,US,35.1028373|-89.8250739,-89.8250739|35.1028373,-89.882219|-89.767708|-89.767708|-89.882219|35.116066|35.116066|35.2054731|35.2054731,https://twitter.com/DeniseforAR/status/1061471403592110080,Denise Garner,"Arkansas, USA","Retired Oncology Nurse, nonprofit founder, mother & grandma. Representative for Arkansas District 84. #Denisefor84",https://t.co/1hsAOCNvfd,FALSE,1844,725,27,764,3386,2017-01-10T02:45:11Z,FALSE,https://t.co/1hsAOCNvfd,http://denisegarner.com,en,https://pbs.twimg.com/profile_banners/818649862967177216/1514915839,http://abs.twimg.com/images/themes/theme1/bg.png,http://pbs.twimg.com/profile_images/818887155338674176/CBrdC3Ts_normal.jpg
818649862967177216,1060543261956337666,2018-11-08T14:43:12Z,DeniseforAR,"Election results haven't been certified but if the numbers hold, these 32 women will start their terms in 2019, the same year as the centennial celebration of women's suffrage in Arkansas. #arleg #arpx https://t.co/8L2fgB2Q9s",Twitter for iPhone,139,,,,FALSE,TRUE,0,37,,,,,,,,,,,,,,474309032,JessiTurnure,en,,,,,,,,,,,,,,,,1060326948860321794,"Election results haven't been certified but if the numbers hold, these 32 women will start their terms in 2019, the same year as the centennial celebration of women's suffrage in Arkansas. #arleg #arpx https://t.co/8L2fgB2Q9s",2018-11-08T00:23:39Z,Twitter Web Client,128,37,474309032,JessiTurnure,Jessi Turnure,3836,1879,5861,"Little Rock, AR","@KARK4News @FOX16News Emmy-winning Political Reporter | @CapitolViewAR Host | @Mizzou JSchool Grad | RTs ≠ endorsements",FALSE,,,,,,,|,|,|||||||,https://twitter.com/DeniseforAR/status/1060543261956337666,Denise Garner,"Arkansas, USA","Retired Oncology Nurse, nonprofit founder, mother & grandma. Representative for Arkansas District 84. #Denisefor84",https://t.co/1hsAOCNvfd,FALSE,1844,725,27,764,3386,2017-01-10T02:45:11Z,FALSE,https://t.co/1hsAOCNvfd,http://denisegarner.com,en,https://pbs.twimg.com/profile_banners/818649862967177216/1514915839,http://abs.twimg.com/images/themes/theme1/bg.png,http://pbs.twimg.com/profile_images/818887155338674176/CBrdC3Ts_normal.jpg
818649862967177216,1060290356233887745,2018-11-07T21:58:14Z,DeniseforAR,"@GayatriAgnew You are a class act, my friend. Brilliant, passionate, and fun. Look forward to working with you to get more Arkansans engaged with the political process!",Twitter for Android,154,1060029869072044032,2448589115,GayatriAgnew,FALSE,FALSE,4,0,,,,,,,,,,,,,,2448589115,GayatriAgnew,en,,,,,,,,,,,,,,,,,,,,,,,,,,,,,,,,,,,,,|,|,|||||||,https://twitter.com/DeniseforAR/status/1060290356233887745,Denise Garner,"Arkansas, USA","Retired Oncology Nurse, nonprofit founder, mother & grandma. Representative for Arkansas District 84. #Denisefor84",https://t.co/1hsAOCNvfd,FALSE,1844,725,27,764,3386,2017-01-10T02:45:11Z,FALSE,https://t.co/1hsAOCNvfd,http://denisegarner.com,en,https://pbs.twimg.com/profile_banners/818649862967177216/1514915839,http://abs.twimg.com/images/themes/theme1/bg.png,http://pbs.twimg.com/profile_images/818887155338674176/CBrdC3Ts_normal.jpg
818649862967177216,1060283055192109056,2018-11-07T21:29:14Z,DeniseforAR,@mariamsiddiqui_ And did it so well!!,Twitter for Android,20,1060044489325207552,1684831447,mariamsiddiqui_,FALSE,FALSE,4,0,,,,,,,,,,,,,,1684831447,mariamsiddiqui_,en,,,,,,,,,,,,,,,,,,,,,,,,,,,,,,,,,,,,,|,|,|||||||,https://twitter.com/DeniseforAR/status/1060283055192109056,Denise Garner,"Arkansas, USA","Retired Oncology Nurse, nonprofit founder, mother & grandma. Representative for Arkansas District 84. #Denisefor84",https://t.co/1hsAOCNvfd,FALSE,1844,725,27,764,3386,2017-01-10T02:45:11Z,FALSE,https://t.co/1hsAOCNvfd,http://denisegarner.com,en,https://pbs.twimg.com/profile_banners/818649862967177216/1514915839,http://abs.twimg.com/images/themes/theme1/bg.png,http://pbs.twimg.com/profile_images/818887155338674176/CBrdC3Ts_normal.jpg
818649862967177216,1060158352712445952,2018-11-07T13:13:42Z,DeniseforAR,Thank you KNWA for hosting me this am! Still doesn't seem quite real... https://t.co/YzjyVQOj2p,Twitter for Android,71,,,,TRUE,FALSE,193,17,,,twitter.com/KZoellnerTV/st…,https://t.co/YzjyVQOj2p,https://twitter.com/KZoellnerTV/status/1060146662528741378,,,,,,,,,,,en,1060146662528741378,"Denise Garner upset Charlie Collins in the race for State House of Representatives District 84.

She is in studio with us right now talking about her win! https://t.co/n2dmuY4wtn",2018-11-07T12:27:15Z,Twitter for iPhone,26,7,39010829,KZoellnerTV,Katelynn Zoellner,2449,85,13041,Northwest Arkansas,"KNWA Morning Anchor. Born and raised in California. Proud SDSU alum, Go Aztecs! Dog mom. Adventurer of life. Coffee addict. Cupcake lover.",FALSE,,,,,,,,,,,,,,,,,,,,,,|,|,|||||||,https://twitter.com/DeniseforAR/status/1060158352712445952,Denise Garner,"Arkansas, USA","Retired Oncology Nurse, nonprofit founder, mother & grandma. Representative for Arkansas District 84. #Denisefor84",https://t.co/1hsAOCNvfd,FALSE,1844,725,27,764,3386,2017-01-10T02:45:11Z,FALSE,https://t.co/1hsAOCNvfd,http://denisegarner.com,en,https://pbs.twimg.com/profile_banners/818649862967177216/1514915839,http://abs.twimg.com/images/themes/theme1/bg.png,http://pbs.twimg.com/profile_images/818887155338674176/CBrdC3Ts_normal.jpg
818649862967177216,1060054675532234753,2018-11-07T06:21:44Z,DeniseforAR,@CollinsARK Thank you!,Twitter for Android,10,1060027855734743041,108117069,CollinsARK,FALSE,FALSE,24,0,,,,,,,,,,,,,,108117069,CollinsARK,en,,,,,,,,,,,,,,,,,,,,,,,,,,,,,,,,,,,,,|,|,|||||||,https://twitter.com/DeniseforAR/status/1060054675532234753,Denise Garner,"Arkansas, USA","Retired Oncology Nurse, nonprofit founder, mother & grandma. Representative for Arkansas District 84. #Denisefor84",https://t.co/1hsAOCNvfd,FALSE,1844,725,27,764,3386,2017-01-10T02:45:11Z,FALSE,https://t.co/1hsAOCNvfd,http://denisegarner.com,en,https://pbs.twimg.com/profile_banners/818649862967177216/1514915839,http://abs.twimg.com/images/themes/theme1/bg.png,http://pbs.twimg.com/profile_images/818887155338674176/CBrdC3Ts_normal.jpg
818649862967177216,1059793470813097984,2018-11-06T13:03:48Z,DeniseforAR,Today.,Twitter for iPhone,6,,,,FALSE,FALSE,109,4,,,,,,,,,,,,,,,,en,,,,,,,,,,,,,,,,,,,,,,,,,,,,,,,,,,,,,|,|,|||||||,https://twitter.com/DeniseforAR/status/1059793470813097984,Denise Garner,"Arkansas, USA","Retired Oncology Nurse, nonprofit founder, mother & grandma. Representative for Arkansas District 84. #Denisefor84",https://t.co/1hsAOCNvfd,FALSE,1844,725,27,764,3386,2017-01-10T02:45:11Z,FALSE,https://t.co/1hsAOCNvfd,http://denisegarner.com,en,https://pbs.twimg.com/profile_banners/818649862967177216/1514915839,http://abs.twimg.com/images/themes/theme1/bg.png,http://pbs.twimg.com/profile_images/818887155338674176/CBrdC3Ts_normal.jpg
818649862967177216,1059632655782817792,2018-11-06T02:24:46Z,DeniseforAR,@angoxford @will_watson Farrell’s Lounge on Dickson at 7:30pm,Twitter for iPhone,37,1059631888225222656,262933930,angoxford,FALSE,FALSE,2,0,,,,,,,,,,,,,,262933930|43380511,angoxford|will_watson,en,,,,,,,,,,,,,,,,,,,,,,,,,,,,,,,,,,,,,|,|,|||||||,https://twitter.com/DeniseforAR/status/1059632655782817792,Denise Garner,"Arkansas, USA","Retired Oncology Nurse, nonprofit founder, mother & grandma. Representative for Arkansas District 84. #Denisefor84",https://t.co/1hsAOCNvfd,FALSE,1844,725,27,764,3386,2017-01-10T02:45:11Z,FALSE,https://t.co/1hsAOCNvfd,http://denisegarner.com,en,https://pbs.twimg.com/profile_banners/818649862967177216/1514915839,http://abs.twimg.com/images/themes/theme1/bg.png,http://pbs.twimg.com/profile_images/818887155338674176/CBrdC3Ts_normal.jpg
818649862967177216,1059572871557718016,2018-11-05T22:27:13Z,DeniseforAR,"@KaceCrawford Thank you, I bet I know who that is.",Twitter for iPhone,36,1059572250049953792,760110459504594944,FruitKace,FALSE,FALSE,2,0,,,,,,,,,,,,,,,,en,,,,,,,,,,,,,,,,,,,,,,,,,,,,,,,,,,,,,|,|,|||||||,https://twitter.com/DeniseforAR/status/1059572871557718016,Denise Garner,"Arkansas, USA","Retired Oncology Nurse, nonprofit founder, mother & grandma. Representative for Arkansas District 84. #Denisefor84",https://t.co/1hsAOCNvfd,FALSE,1844,725,27,764,3386,2017-01-10T02:45:11Z,FALSE,https://t.co/1hsAOCNvfd,http://denisegarner.com,en,https://pbs.twimg.com/profile_banners/818649862967177216/1514915839,http://abs.twimg.com/images/themes/theme1/bg.png,http://pbs.twimg.com/profile_images/818887155338674176/CBrdC3Ts_normal.jpg
818649862967177216,1059523433967636487,2018-11-05T19:10:46Z,DeniseforAR,"It's Election Day Eve, &amp; I am overwhelmed w/ the gratitude &amp; kindness of Dist. 84. From giving financially to knocking on doors in the cold &amp; rain, I've thoroughly enjoyed campaigning for your vote. No matter what happens tomorrow, friends &amp; neighbors, THANK YOU so much! #arpx https://t.co/nJ2YL70jRE",Twitter Web Client,293,,,,FALSE,FALSE,81,17,arpx,,,,,http://pbs.twimg.com/ext_tw_video_thumb/1059522061838639104/pu/img/_KQy7SdJe_nHlG7y.jpg,https://t.co/nJ2YL70jRE,https://twitter.com/DeniseforAR/status/1059523433967636487/video/1,photo,http://pbs.twimg.com/ext_tw_video_thumb/1059522061838639104/pu/img/_KQy7SdJe_nHlG7y.jpg,https://t.co/nJ2YL70jRE,https://twitter.com/DeniseforAR/status/1059523433967636487/video/1,,,,en,,,,,,,,,,,,,,,,,,,,,,,,,,,,,,,,,,,,,|,|,|||||||,https://twitter.com/DeniseforAR/status/1059523433967636487,Denise Garner,"Arkansas, USA","Retired Oncology Nurse, nonprofit founder, mother & grandma. Representative for Arkansas District 84. #Denisefor84",https://t.co/1hsAOCNvfd,FALSE,1844,725,27,764,3386,2017-01-10T02:45:11Z,FALSE,https://t.co/1hsAOCNvfd,http://denisegarner.com,en,https://pbs.twimg.com/profile_banners/818649862967177216/1514915839,http://abs.twimg.com/images/themes/theme1/bg.png,http://pbs.twimg.com/profile_images/818887155338674176/CBrdC3Ts_normal.jpg
818649862967177216,1059266780600905728,2018-11-05T02:10:55Z,DeniseforAR,"Arkansans are worried about their health care—frankly, they should be.

Most Arkansans simply can’t afford to get sick. My husband &amp; I spent our lives helping others in the health care sector. As a nurse I fought for my patients' care, &amp; as your rep in the #arleg I'll do the same https://t.co/nvPaSywGID",Twitter for iPhone,288,,,,FALSE,FALSE,67,19,arleg,,,,,http://pbs.twimg.com/media/DrNFhFjU4AAkcyN.jpg,https://t.co/nvPaSywGID,https://twitter.com/DeniseforAR/status/1059266780600905728/photo/1,photo,http://pbs.twimg.com/media/DrNFhFjU4AAkcyN.jpg,https://t.co/nvPaSywGID,https://twitter.com/DeniseforAR/status/1059266780600905728/photo/1,,,,en,,,,,,,,,,,,,,,,,,,,,,,,,,,,,,,,,,,,,|,|,|||||||,https://twitter.com/DeniseforAR/status/1059266780600905728,Denise Garner,"Arkansas, USA","Retired Oncology Nurse, nonprofit founder, mother & grandma. Representative for Arkansas District 84. #Denisefor84",https://t.co/1hsAOCNvfd,FALSE,1844,725,27,764,3386,2017-01-10T02:45:11Z,FALSE,https://t.co/1hsAOCNvfd,http://denisegarner.com,en,https://pbs.twimg.com/profile_banners/818649862967177216/1514915839,http://abs.twimg.com/images/themes/theme1/bg.png,http://pbs.twimg.com/profile_images/818887155338674176/CBrdC3Ts_normal.jpg
818649862967177216,1058831400101666816,2018-11-03T21:20:52Z,DeniseforAR,"@LaurieLee0966 @ArkDems I'd think you know me well enough 2 know that data, as well as values &amp; opinions of District 84 voters, would determine my positions on complex policy issues. That's what I've done my entire career. I'll be glad 2 sit down &amp; discuss particular concerns.",Twitter for Android,261,1058816732771561472,236534665,LaurieLee0966,FALSE,FALSE,0,0,,,,,,,,,,,,,,236534665|58520492,LaurieLee0966|ArkDems,en,,,,,,,,,,,,,,,,,,,,,,,,,,,,,,,,,,,,,|,|,|||||||,https://twitter.com/DeniseforAR/status/1058831400101666816,Denise Garner,"Arkansas, USA","Retired Oncology Nurse, nonprofit founder, mother & grandma. Representative for Arkansas District 84. #Denisefor84",https://t.co/1hsAOCNvfd,FALSE,1844,725,27,764,3386,2017-01-10T02:45:11Z,FALSE,https://t.co/1hsAOCNvfd,http://denisegarner.com,en,https://pbs.twimg.com/profile_banners/818649862967177216/1514915839,http://abs.twimg.com/images/themes/theme1/bg.png,http://pbs.twimg.com/profile_images/818887155338674176/CBrdC3Ts_normal.jpg
818649862967177216,1058530189788016641,2018-11-03T01:23:58Z,DeniseforAR,"Politics should be about ppl. My opponent didn't listen to ppl directly affected by his guns-everywhere law. Let's get back to what Arkansans are best at--common sense, &amp; leading from the reasonable middle. I care about your voice, &amp; I would be honored to have your vote on Nov. 6 https://t.co/iqngJjRBtC",Twitter Web Client,288,,,,FALSE,FALSE,140,48,,,,,,http://pbs.twimg.com/media/DrCmdpQVAAE2xRi.jpg,https://t.co/iqngJjRBtC,https://twitter.com/DeniseforAR/status/1058530189788016641/photo/1,photo,http://pbs.twimg.com/media/DrCmdpQVAAE2xRi.jpg,https://t.co/iqngJjRBtC,https://twitter.com/DeniseforAR/status/1058530189788016641/photo/1,,,,en,,,,,,,,,,,,,,,,,,,,,,,,,,,,,,,,,,,,,|,|,|||||||,https://twitter.com/DeniseforAR/status/1058530189788016641,Denise Garner,"Arkansas, USA","Retired Oncology Nurse, nonprofit founder, mother & grandma. Representative for Arkansas District 84. #Denisefor84",https://t.co/1hsAOCNvfd,FALSE,1844,725,27,764,3386,2017-01-10T02:45:11Z,FALSE,https://t.co/1hsAOCNvfd,http://denisegarner.com,en,https://pbs.twimg.com/profile_banners/818649862967177216/1514915839,http://abs.twimg.com/images/themes/theme1/bg.png,http://pbs.twimg.com/profile_images/818887155338674176/CBrdC3Ts_normal.jpg
818649862967177216,1058131897455403009,2018-11-01T23:01:18Z,DeniseforAR,Canvassing in the rain for @DeniseforAR @MomsDemand #GunSenseCandidate #arleg https://t.co/8AFrIgLerB,Twitter for iPhone,121,,,,FALSE,TRUE,0,5,GunSenseCandidate|arleg,,,,,http://pbs.twimg.com/media/Dq8ArfLUwAU1fbF.jpg,https://t.co/8AFrIgLerB,https://twitter.com/catherinecritz/status/1058065204905435136/photo/1,photo,http://pbs.twimg.com/media/Dq8ArfLUwAU1fbF.jpg,https://t.co/8AFrIgLerB,https://twitter.com/catherinecritz/status/1058065204905435136/photo/1,,4458434901|818649862967177216|1017637447,catherinecritz|DeniseforAR|MomsDemand,en,,,,,,,,,,,,,,,,1058065204905435136,Canvassing in the rain for @DeniseforAR @MomsDemand #GunSenseCandidate #arleg https://t.co/8AFrIgLerB,2018-11-01T18:36:17Z,Twitter for iPad,24,5,4458434901,catherinecritz,Catherine Snyder,1495,2027,73340,"Arkansas, USA",Love is Love. Families Belong Together. Not One More. Smash White Supremacy. Medicare for All. Black Lives Matter. All views are my own.,FALSE,,,,,,,|,|,|||||||,https://twitter.com/DeniseforAR/status/1058131897455403009,Denise Garner,"Arkansas, USA","Retired Oncology Nurse, nonprofit founder, mother & grandma. Representative for Arkansas District 84. #Denisefor84",https://t.co/1hsAOCNvfd,FALSE,1844,725,27,764,3386,2017-01-10T02:45:11Z,FALSE,https://t.co/1hsAOCNvfd,http://denisegarner.com,en,https://pbs.twimg.com/profile_banners/818649862967177216/1514915839,http://abs.twimg.com/images/themes/theme1/bg.png,http://pbs.twimg.com/profile_images/818887155338674176/CBrdC3Ts_normal.jpg
818649862967177216,1057830753986400258,2018-11-01T03:04:39Z,DeniseforAR,Halloween isn’t April Fool’s. https://t.co/099RLcsxeb,Twitter for iPhone,29,,,,TRUE,FALSE,75,5,,,twitter.com/realDonaldTrum…,https://t.co/099RLcsxeb,https://twitter.com/realDonaldTrump/status/1057655675080314880,,,,,,,,,,,en,1057655675080314880,Republicans will protect people with pre-existing conditions far better than the Dems!,2018-10-31T15:28:57Z,Twitter for iPhone,76512,19307,25073877,realDonaldTrump,Donald J. Trump,58623600,45,40674,"Washington, DC",45th President of the United States of America🇺🇸,TRUE,,,,,,,,,,,,,,,,,,,,,,|,|,|||||||,https://twitter.com/DeniseforAR/status/1057830753986400258,Denise Garner,"Arkansas, USA","Retired Oncology Nurse, nonprofit founder, mother & grandma. Representative for Arkansas District 84. #Denisefor84",https://t.co/1hsAOCNvfd,FALSE,1844,725,27,764,3386,2017-01-10T02:45:11Z,FALSE,https://t.co/1hsAOCNvfd,http://denisegarner.com,en,https://pbs.twimg.com/profile_banners/818649862967177216/1514915839,http://abs.twimg.com/images/themes/theme1/bg.png,http://pbs.twimg.com/profile_images/818887155338674176/CBrdC3Ts_normal.jpg
818649862967177216,1057789871274758145,2018-11-01T00:22:12Z,DeniseforAR,"I had a great time passing out candy to kids at the Boo on the Fayetteville Square today. I loved seeing all the cute costumes! 💙💙💙 Such a great turnout despite the rain too!!!

Happy Halloween! #arpx https://t.co/JhGF0KTXQQ",Twitter for iPhone,200,,,,FALSE,FALSE,31,3,arpx,,,,,http://pbs.twimg.com/media/Dq4GQsfUcAApB5B.jpg,https://t.co/JhGF0KTXQQ,https://twitter.com/DeniseforAR/status/1057789871274758145/photo/1,photo,http://pbs.twimg.com/media/Dq4GQsfUcAApB5B.jpg|http://pbs.twimg.com/media/Dq4GQsXVYAEnaJi.jpg|http://pbs.twimg.com/media/Dq4GQsTVAAAYCdz.jpg|http://pbs.twimg.com/media/Dq4GQscU0AI-1p4.jpg,https://t.co/JhGF0KTXQQ|https://t.co/JhGF0KTXQQ|https://t.co/JhGF0KTXQQ|https://t.co/JhGF0KTXQQ,https://twitter.com/DeniseforAR/status/1057789871274758145/photo/1|https://twitter.com/DeniseforAR/status/1057789871274758145/photo/1|https://twitter.com/DeniseforAR/status/1057789871274758145/photo/1|https://twitter.com/DeniseforAR/status/1057789871274758145/photo/1,,,,en,,,,,,,,,,,,,,,,,,,,,,,,,,,,,,,,,,,,,|,|,|||||||,https://twitter.com/DeniseforAR/status/1057789871274758145,Denise Garner,"Arkansas, USA","Retired Oncology Nurse, nonprofit founder, mother & grandma. Representative for Arkansas District 84. #Denisefor84",https://t.co/1hsAOCNvfd,FALSE,1844,725,27,764,3386,2017-01-10T02:45:11Z,FALSE,https://t.co/1hsAOCNvfd,http://denisegarner.com,en,https://pbs.twimg.com/profile_banners/818649862967177216/1514915839,http://abs.twimg.com/images/themes/theme1/bg.png,http://pbs.twimg.com/profile_images/818887155338674176/CBrdC3Ts_normal.jpg
818649862967177216,1057701626763460608,2018-10-31T18:31:33Z,DeniseforAR,"We just heard from the Washington Co. Election Commission &amp; County Clerk’s Office that Dist. 84 was left off the ballot for anyone who lives on Sinclair Ave., just east of Stonebridge Meadows. We’ll try to reach out to those who have already voted @4029news @KNWAnews @5NEWS #arpx",Twitter for iPhone,284,,,,FALSE,FALSE,30,25,arpx,,,,,,,,,,,,,15922892|108352504|24778454,4029news|KNWAnews|5NEWS,en,,,,,,,,,,,,,,,,,,,,,,,,,,,,,,,,,,,,,|,|,|||||||,https://twitter.com/DeniseforAR/status/1057701626763460608,Denise Garner,"Arkansas, USA","Retired Oncology Nurse, nonprofit founder, mother & grandma. Representative for Arkansas District 84. #Denisefor84",https://t.co/1hsAOCNvfd,FALSE,1844,725,27,764,3386,2017-01-10T02:45:11Z,FALSE,https://t.co/1hsAOCNvfd,http://denisegarner.com,en,https://pbs.twimg.com/profile_banners/818649862967177216/1514915839,http://abs.twimg.com/images/themes/theme1/bg.png,http://pbs.twimg.com/profile_images/818887155338674176/CBrdC3Ts_normal.jpg
818649862967177216,1057447576218361856,2018-10-31T01:42:03Z,DeniseforAR,"Washington Co. Early Vote Numbers - Day 8 

2014 = 9,769
2016 = 28,786
2018 = 20,388

Catching up to presidential numbers. #GoEarlyVote",Twitter for iPhone,140,,,,FALSE,TRUE,0,6,,,,,,,,,,,,,,614803198,DustinSeaton,en,,,,,,,,,,,,,,,,1057431713939361794,"Washington Co. Early Vote Numbers - Day 8 

2014 = 9,769
2016 = 28,786
2018 = 20,388

Catching up to presidential numbers. #GoEarlyVote",2018-10-31T00:39:01Z,Facebook,32,6,614803198,DustinSeaton,Dustin Seaton,568,1062,1944,"Fayetteville, AR","Proud Arkansan & Hog Fan ~ Abe Lincoln with Glasses ~ Teacher, Father, & Husband to a Beautiful Jazzerciser ~ Donkey & Wine Enthusiast ~ Button Collector",FALSE,,,,,,,|,|,|||||||,https://twitter.com/DeniseforAR/status/1057447576218361856,Denise Garner,"Arkansas, USA","Retired Oncology Nurse, nonprofit founder, mother & grandma. Representative for Arkansas District 84. #Denisefor84",https://t.co/1hsAOCNvfd,FALSE,1844,725,27,764,3386,2017-01-10T02:45:11Z,FALSE,https://t.co/1hsAOCNvfd,http://denisegarner.com,en,https://pbs.twimg.com/profile_banners/818649862967177216/1514915839,http://abs.twimg.com/images/themes/theme1/bg.png,http://pbs.twimg.com/profile_images/818887155338674176/CBrdC3Ts_normal.jpg
