818649862967177216,1011063629796528128,2018-06-25T01:48:48Z,DeniseforAR,I’m very sorry to hear of the passing of Don Zimmerman @ARMuniLeague He lead the Municipal League w/ such passion &amp; professionalism. It’s a terrible loss for all of Arkansas &amp; the many cities he represented. Hershey &amp; I are praying for his family during this difficult time #arpx,Twitter for iPhone,291,,,,FALSE,FALSE,11,1,arpx,,,,,,,,,,,,,1380347376,ARMuniLeague,en,,,,,,,,,,,,,,,,,,,,,,,,,,,,,,,,,,,,,|,|,|||||||,https://twitter.com/DeniseforAR/status/1011063629796528128,Denise Garner,"Arkansas, USA","Retired Oncology Nurse, nonprofit founder, mother & grandma. Representative for Arkansas District 84. #Denisefor84",https://t.co/1hsAOCNvfd,FALSE,1844,725,27,764,3386,2017-01-10T02:45:11Z,FALSE,https://t.co/1hsAOCNvfd,http://denisegarner.com,en,https://pbs.twimg.com/profile_banners/818649862967177216/1514915839,http://abs.twimg.com/images/themes/theme1/bg.png,http://pbs.twimg.com/profile_images/818887155338674176/CBrdC3Ts_normal.jpg
818649862967177216,1011045121410912257,2018-06-25T00:35:15Z,DeniseforAR,"@OZRKIndivisible + @joshuamahony = win/win!
Congratulations!! https://t.co/gfdb07M5tD",Twitter for Android,61,,821485649371000834,OZRKIndivisible,TRUE,FALSE,15,5,,,twitter.com/OZRKIndivisibl…,https://t.co/gfdb07M5tD,https://twitter.com/OZRKIndivisible/status/1010964317964029953,,,,,,,,,821485649371000834|76038071,OZRKIndivisible|joshuamahony,en,1010964317964029953,Ozark Indivisible is happy to formally endorse @joshuamahony! #AR03 #ARVotesCount https://t.co/kY1ANCCHi8,2018-06-24T19:14:10Z,Twitter for iPhone,61,16,821485649371000834,OZRKIndivisible,Ozark Indivisible,4068,1552,13205,Northwest Arkansas,"",FALSE,,,,,,,,,,,,,,,,,,,,,,|,|,|||||||,https://twitter.com/DeniseforAR/status/1011045121410912257,Denise Garner,"Arkansas, USA","Retired Oncology Nurse, nonprofit founder, mother & grandma. Representative for Arkansas District 84. #Denisefor84",https://t.co/1hsAOCNvfd,FALSE,1844,725,27,764,3386,2017-01-10T02:45:11Z,FALSE,https://t.co/1hsAOCNvfd,http://denisegarner.com,en,https://pbs.twimg.com/profile_banners/818649862967177216/1514915839,http://abs.twimg.com/images/themes/theme1/bg.png,http://pbs.twimg.com/profile_images/818887155338674176/CBrdC3Ts_normal.jpg
818649862967177216,1010987383674818560,2018-06-24T20:45:50Z,DeniseforAR,"I interviewed survivors of Rohwer and other Japanese incarceration camps. A facility for unaccompanied #migrantchildren might be built on Rohwer land in Kelso, AR. 

Some survivors and scholars say this looks too familiar:
#ARNews #arpx #Immigration https://t.co/XNX8Gyx058",Twitter for iPhone,140,,,,FALSE,TRUE,0,41,migrantchildren,,,,,,,,,,,,,600744536,EmmaJanePettit,en,,,,,,,,,,,,,,,,1010932763917279232,"I interviewed survivors of Rohwer and other Japanese incarceration camps. A facility for unaccompanied #migrantchildren might be built on Rohwer land in Kelso, AR. 

Some survivors and scholars say this looks too familiar:
#ARNews #arpx #Immigration https://t.co/XNX8Gyx058",2018-06-24T17:08:47Z,Twitter for iPhone,43,41,600744536,EmmaJanePettit,Emma Pettit,2406,2934,5697,"","reporter @chronicle covering faculty life. aspiring crone. she/hers. DMs open, tell me things: emma.pettit@chronicle.com",FALSE,,,,,,,|,|,|||||||,https://twitter.com/DeniseforAR/status/1010987383674818560,Denise Garner,"Arkansas, USA","Retired Oncology Nurse, nonprofit founder, mother & grandma. Representative for Arkansas District 84. #Denisefor84",https://t.co/1hsAOCNvfd,FALSE,1844,725,27,764,3386,2017-01-10T02:45:11Z,FALSE,https://t.co/1hsAOCNvfd,http://denisegarner.com,en,https://pbs.twimg.com/profile_banners/818649862967177216/1514915839,http://abs.twimg.com/images/themes/theme1/bg.png,http://pbs.twimg.com/profile_images/818887155338674176/CBrdC3Ts_normal.jpg
818649862967177216,1010948338051624966,2018-06-24T18:10:40Z,DeniseforAR,Arkansas should elect more women and @MomsDemand gun sense candidates like @DeniseforAR @monicaball2018 and @jessmallettAR @ardameocrats #Election2018 https://t.co/o8kqoLqQyj,Twitter for Android,139,,,,FALSE,TRUE,0,17,,,,,,,,,,,,,,455809758|1017637447|818649862967177216|927761064414121984|892042534628806656,evesuzanne|MomsDemand|DeniseforAR|monicaball2018|jessmallettAR,en,,,,,,,,,,,,,,,,1010939536505962503,Arkansas should elect more women and @MomsDemand gun sense candidates like @DeniseforAR @monicaball2018 and @jessmallettAR @ardameocrats #Election2018 https://t.co/o8kqoLqQyj,2018-06-24T17:35:42Z,Twitter for iPhone,41,17,455809758,evesuzanne,eve from Arkansas,3727,4911,17689,"Arkansas, USA","mom of two kids, feminist, wife. Arkansas chapter leader @momsdemand (All views are my own.)",FALSE,,,,,,,|,|,|||||||,https://twitter.com/DeniseforAR/status/1010948338051624966,Denise Garner,"Arkansas, USA","Retired Oncology Nurse, nonprofit founder, mother & grandma. Representative for Arkansas District 84. #Denisefor84",https://t.co/1hsAOCNvfd,FALSE,1844,725,27,764,3386,2017-01-10T02:45:11Z,FALSE,https://t.co/1hsAOCNvfd,http://denisegarner.com,en,https://pbs.twimg.com/profile_banners/818649862967177216/1514915839,http://abs.twimg.com/images/themes/theme1/bg.png,http://pbs.twimg.com/profile_images/818887155338674176/CBrdC3Ts_normal.jpg
818649862967177216,1010361968937586690,2018-06-23T03:20:39Z,DeniseforAR,"“The presence of multiple guns makes response much more complicated for law enforcement officers when dealing with an active-shooter situation"" ~Stephannie Baker, volunteer, Arkansas Moms Demand Action https://t.co/tEJFeZNP99",Twitter for Android,140,,,,FALSE,TRUE,0,51,,,,,,,,,,,,,,1017637447,MomsDemand,en,,,,,,,,,,,,,,,,1010225158123151361,"“The presence of multiple guns makes response much more complicated for law enforcement officers when dealing with an active-shooter situation"" ~Stephannie Baker, volunteer, Arkansas Moms Demand Action https://t.co/tEJFeZNP99",2018-06-22T18:17:01Z,Buffer,126,51,1017637447,MomsDemand,Moms Demand Action,222843,10110,33602,USA,Join our grassroots movement of Americans demanding reasonable solutions to address our nation’s culture of gun violence. @MomsDemand is a part of @Everytown.,TRUE,,,,,,,|,|,|||||||,https://twitter.com/DeniseforAR/status/1010361968937586690,Denise Garner,"Arkansas, USA","Retired Oncology Nurse, nonprofit founder, mother & grandma. Representative for Arkansas District 84. #Denisefor84",https://t.co/1hsAOCNvfd,FALSE,1844,725,27,764,3386,2017-01-10T02:45:11Z,FALSE,https://t.co/1hsAOCNvfd,http://denisegarner.com,en,https://pbs.twimg.com/profile_banners/818649862967177216/1514915839,http://abs.twimg.com/images/themes/theme1/bg.png,http://pbs.twimg.com/profile_images/818887155338674176/CBrdC3Ts_normal.jpg
818649862967177216,1010242327196127232,2018-06-22T19:25:14Z,DeniseforAR,"Never in our history have we had a #FarmBill passed w/o bi-partisan support. Till now. STOP the House bill. YES on bi-partisan Senate bill, passed 20-1 in Committee. Call @JohnBoozman @TomCottonAR @ARHungerRelief https://t.co/jiULzJzBLD",Twitter for Android,140,,,,FALSE,TRUE,0,15,FarmBill,,,,,,,,,,,,,17459358,KathyLWebb,en,,,,,,,,,,,,,,,,1010118355976622081,"Never in our history have we had a #FarmBill passed w/o bi-partisan support. Till now. STOP the House bill. YES on bi-partisan Senate bill, passed 20-1 in Committee. Call @JohnBoozman @TomCottonAR @ARHungerRelief https://t.co/jiULzJzBLD",2018-06-22T11:12:37Z,Twitter for iPhone,20,15,17459358,KathyLWebb,Kathy Webb,3332,643,6364,"Little Rock, AR","Devoted aunt/great-aunt. PK/Christian/feminist/progressive/LGBT. Cancer survivor. Love 🐕 🍿🐈 📖 ⚾️ ED AR Hunger Relief Alliance; City Director, Ward 3, LR.",FALSE,,,,,,,|,|,|||||||,https://twitter.com/DeniseforAR/status/1010242327196127232,Denise Garner,"Arkansas, USA","Retired Oncology Nurse, nonprofit founder, mother & grandma. Representative for Arkansas District 84. #Denisefor84",https://t.co/1hsAOCNvfd,FALSE,1844,725,27,764,3386,2017-01-10T02:45:11Z,FALSE,https://t.co/1hsAOCNvfd,http://denisegarner.com,en,https://pbs.twimg.com/profile_banners/818649862967177216/1514915839,http://abs.twimg.com/images/themes/theme1/bg.png,http://pbs.twimg.com/profile_images/818887155338674176/CBrdC3Ts_normal.jpg
818649862967177216,1009954131992305665,2018-06-22T00:20:03Z,DeniseforAR,"It’s such a pleasure to hear from more neighbors in Dist. 84 tonight. They’re ready for leadership that answers to them &amp; not lobbyists. They’re tired of politicians who are for sale.

When you send me to #arleg, I pledge to answer to you. I will put you &amp; your family first #arpx https://t.co/c2zyYpNT3B",Twitter for iPhone,288,,,,FALSE,FALSE,22,7,arleg|arpx,,,,,http://pbs.twimg.com/media/DgQT7OhUcAARPpX.jpg,https://t.co/c2zyYpNT3B,https://twitter.com/DeniseforAR/status/1009954131992305665/photo/1,photo,http://pbs.twimg.com/media/DgQT7OhUcAARPpX.jpg|http://pbs.twimg.com/media/DgQT7PaUYAAFq06.jpg|http://pbs.twimg.com/media/DgQT7PaV4AEHQlF.jpg|http://pbs.twimg.com/media/DgQT7PYU8AAB28d.jpg,https://t.co/c2zyYpNT3B|https://t.co/c2zyYpNT3B|https://t.co/c2zyYpNT3B|https://t.co/c2zyYpNT3B,https://twitter.com/DeniseforAR/status/1009954131992305665/photo/1|https://twitter.com/DeniseforAR/status/1009954131992305665/photo/1|https://twitter.com/DeniseforAR/status/1009954131992305665/photo/1|https://twitter.com/DeniseforAR/status/1009954131992305665/photo/1,,,,en,,,,,,,,,,,,,,,,,,,,,,,,,,,,,,,,,,,,,|,|,|||||||,https://twitter.com/DeniseforAR/status/1009954131992305665,Denise Garner,"Arkansas, USA","Retired Oncology Nurse, nonprofit founder, mother & grandma. Representative for Arkansas District 84. #Denisefor84",https://t.co/1hsAOCNvfd,FALSE,1844,725,27,764,3386,2017-01-10T02:45:11Z,FALSE,https://t.co/1hsAOCNvfd,http://denisegarner.com,en,https://pbs.twimg.com/profile_banners/818649862967177216/1514915839,http://abs.twimg.com/images/themes/theme1/bg.png,http://pbs.twimg.com/profile_images/818887155338674176/CBrdC3Ts_normal.jpg
818649862967177216,1009900105615532034,2018-06-21T20:45:22Z,DeniseforAR,"Whatever the true reason, the optics are deplorable... #KeepFamiliesTogether https://t.co/Un3SWFsrAv",Twitter for Android,76,,,,TRUE,FALSE,10,1,KeepFamiliesTogether,,twitter.com/timkmak/status…,https://t.co/Un3SWFsrAv,https://twitter.com/timkmak/status/1009860929897553920,,,,,,,,,,,en,1009860929897553920,"Daily Mail reports that Melania Trump boarded her plane to Texas wearing a jacket that said on the back, ""I really don't care, do u?""

https://t.co/SeNGeux5jB https://t.co/owHqTAyPdO",2018-06-21T18:09:42Z,TweetDeck,10667,7353,17907987,timkmak,Tim Mak,64048,1609,35729,"Washington, DC","Reporter, NPR's Washington Desk. Covers national security/politics. 

202/870-7566 Gmail: timkmak.
DMs are open",TRUE,,,,,,,,,,,,,,,,,,,,,,|,|,|||||||,https://twitter.com/DeniseforAR/status/1009900105615532034,Denise Garner,"Arkansas, USA","Retired Oncology Nurse, nonprofit founder, mother & grandma. Representative for Arkansas District 84. #Denisefor84",https://t.co/1hsAOCNvfd,FALSE,1844,725,27,764,3386,2017-01-10T02:45:11Z,FALSE,https://t.co/1hsAOCNvfd,http://denisegarner.com,en,https://pbs.twimg.com/profile_banners/818649862967177216/1514915839,http://abs.twimg.com/images/themes/theme1/bg.png,http://pbs.twimg.com/profile_images/818887155338674176/CBrdC3Ts_normal.jpg
818649862967177216,1009833245033287680,2018-06-21T16:19:42Z,DeniseforAR,@CollinsARK Cyndi Lauper - True Colors (Video) https://t.co/vKRqoiMVph via @YouTube,Twitter for iPhone,71,1009817848502521856,108117069,CollinsARK,FALSE,FALSE,3,0,,,youtu.be/LPn0KFlbqX8,https://t.co/vKRqoiMVph,https://youtu.be/LPn0KFlbqX8,,,,,,,,,108117069|10228272,CollinsARK|YouTube,fr,,,,,,,,,,,,,,,,,,,,,,,,,,,,,,,,,,,,,|,|,|||||||,https://twitter.com/DeniseforAR/status/1009833245033287680,Denise Garner,"Arkansas, USA","Retired Oncology Nurse, nonprofit founder, mother & grandma. Representative for Arkansas District 84. #Denisefor84",https://t.co/1hsAOCNvfd,FALSE,1844,725,27,764,3386,2017-01-10T02:45:11Z,FALSE,https://t.co/1hsAOCNvfd,http://denisegarner.com,en,https://pbs.twimg.com/profile_banners/818649862967177216/1514915839,http://abs.twimg.com/images/themes/theme1/bg.png,http://pbs.twimg.com/profile_images/818887155338674176/CBrdC3Ts_normal.jpg
818649862967177216,1009821039050805248,2018-06-21T15:31:11Z,DeniseforAR,This tweet doesn’t make sense Charlie. I applauded you for being bipartisan &amp; you respond with ramblings of hyper-partisanship &amp; hashtags. 🤦‍♀️ https://t.co/NHZVGsmCV8,Twitter for iPhone,151,,,,TRUE,FALSE,19,1,,,twitter.com/collinsark/sta…,https://t.co/NHZVGsmCV8,https://twitter.com/collinsark/status/1009817848502521856,,,,,,,,,,,en,1009817848502521856,"Reread your tweet, you told me who I disagree with. Truth is I disagree with Dem partisanship because #blue #progressive liberals are intractable. In 2017 DNC chair even declared that Dems would only support pro choice on abortion candidates. DC Dems acting as obstructionists. https://t.co/a9DKjUbsR2",2018-06-21T15:18:31Z,Twitter for Android,1,0,108117069,CollinsARK,Charlie Collins,5142,3624,23413,"Washington County, Arkansas",Arkansas,FALSE,,,,,,,,,,,,,,,,,,,,,,|,|,|||||||,https://twitter.com/DeniseforAR/status/1009821039050805248,Denise Garner,"Arkansas, USA","Retired Oncology Nurse, nonprofit founder, mother & grandma. Representative for Arkansas District 84. #Denisefor84",https://t.co/1hsAOCNvfd,FALSE,1844,725,27,764,3386,2017-01-10T02:45:11Z,FALSE,https://t.co/1hsAOCNvfd,http://denisegarner.com,en,https://pbs.twimg.com/profile_banners/818649862967177216/1514915839,http://abs.twimg.com/images/themes/theme1/bg.png,http://pbs.twimg.com/profile_images/818887155338674176/CBrdC3Ts_normal.jpg
818649862967177216,1009815267357151234,2018-06-21T15:08:15Z,DeniseforAR,You said it’ll take Democrats &amp; Republicans working together to fix. @ARGOP Chair Doyle Webb said it’s the Dems fault &amp; President Trump/Congressional Republicans will fix it. Reread his statement &amp; your tweets. I don’t put words in your #arpx mouth. https://t.co/S01zbVQWJ5,Twitter for iPhone,261,,,,TRUE,FALSE,16,3,arpx,,twitter.com/collinsark/sta…,https://t.co/S01zbVQWJ5,https://twitter.com/collinsark/status/1009812453239160833,,,,,,,,,29063765,ARGOP,en,1009812453239160833,Don't put words in my #arpx mouth. Dem intransigence on securing border = major source of our illegal immigration problems &amp; Dem opposition to best practices like Canda's merit system is puzzling. DACA seemed like Dem priority until it wasn't. Obstruction appears to be Dem goal. https://t.co/G4qWujYfIK,2018-06-21T14:57:04Z,Twitter for Android,1,0,108117069,CollinsARK,Charlie Collins,5142,3624,23413,"Washington County, Arkansas",Arkansas,FALSE,,,,,,,,,,,,,,,,,,,,,,|,|,|||||||,https://twitter.com/DeniseforAR/status/1009815267357151234,Denise Garner,"Arkansas, USA","Retired Oncology Nurse, nonprofit founder, mother & grandma. Representative for Arkansas District 84. #Denisefor84",https://t.co/1hsAOCNvfd,FALSE,1844,725,27,764,3386,2017-01-10T02:45:11Z,FALSE,https://t.co/1hsAOCNvfd,http://denisegarner.com,en,https://pbs.twimg.com/profile_banners/818649862967177216/1514915839,http://abs.twimg.com/images/themes/theme1/bg.png,http://pbs.twimg.com/profile_images/818887155338674176/CBrdC3Ts_normal.jpg
818649862967177216,1009810463012589568,2018-06-21T14:49:10Z,DeniseforAR,"I glad you disagree with @ARGOP chair’s partisanship. It will take D’s &amp; R’s, but this issue will not be resolved quickly. The President’s Executive Order only protects against family separations for 20 days. It also doesn’t address the thousands of children currently separated https://t.co/E0FyTl6v1V",Twitter for iPhone,282,,,,TRUE,FALSE,12,7,,,twitter.com/collinsark/sta…,https://t.co/E0FyTl6v1V,https://twitter.com/collinsark/status/1009804254679322624,,,,,,,,,29063765,ARGOP,en,1009804254679322624,I predicted Tuesday night on #arpx @5NEWS that family separation issue would be resolved quickly &amp; I'm happy DJT admin changed course Wednesday on that issue. We still have much to do on overall illegal immigration challenge &amp; it will take R's &amp; D's in DC working together to fix. https://t.co/kd5BvaO7jN,2018-06-21T14:24:30Z,Twitter for Android,2,1,108117069,CollinsARK,Charlie Collins,5142,3624,23413,"Washington County, Arkansas",Arkansas,FALSE,,,,,,,,,,,,,,,,,,,,,,|,|,|||||||,https://twitter.com/DeniseforAR/status/1009810463012589568,Denise Garner,"Arkansas, USA","Retired Oncology Nurse, nonprofit founder, mother & grandma. Representative for Arkansas District 84. #Denisefor84",https://t.co/1hsAOCNvfd,FALSE,1844,725,27,764,3386,2017-01-10T02:45:11Z,FALSE,https://t.co/1hsAOCNvfd,http://denisegarner.com,en,https://pbs.twimg.com/profile_banners/818649862967177216/1514915839,http://abs.twimg.com/images/themes/theme1/bg.png,http://pbs.twimg.com/profile_images/818887155338674176/CBrdC3Ts_normal.jpg
818649862967177216,1009801766072963073,2018-06-21T14:14:36Z,DeniseforAR,".@CollinsARK are you standing by your @ARGOP chair’s lies &amp; blame game? This is a moral issue, not a political one. We need Democrats &amp; Republicans working together rather than lying about the other side. Children are literally being separated from their families #arpx https://t.co/yDWlQH5tlH",Twitter for iPhone,277,,,,TRUE,FALSE,24,5,arpx,,twitter.com/argop/status/1…,https://t.co/yDWlQH5tlH,https://twitter.com/argop/status/1009191218193031168,,,,,,,,,108117069|29063765,CollinsARK|ARGOP,en,1009191218193031168,"The current immigration crisis can be attributed to @TheDemocrats @ArkDems. Their inability to secure our borders and uphold the Rule of Law has brought us to this point. Unfortunately, these migrant children are the result of their folly. #arpx https://t.co/VSH1yMBltm",2018-06-19T21:48:30Z,Twitter Web Client,5,1,29063765,ARGOP,Arkansas GOP,12915,226,12307,"Little Rock, AR",Official account for the Republican Party of Arkansas,TRUE,,,,,,,,,,,,,,,,,,,,,,|,|,|||||||,https://twitter.com/DeniseforAR/status/1009801766072963073,Denise Garner,"Arkansas, USA","Retired Oncology Nurse, nonprofit founder, mother & grandma. Representative for Arkansas District 84. #Denisefor84",https://t.co/1hsAOCNvfd,FALSE,1844,725,27,764,3386,2017-01-10T02:45:11Z,FALSE,https://t.co/1hsAOCNvfd,http://denisegarner.com,en,https://pbs.twimg.com/profile_banners/818649862967177216/1514915839,http://abs.twimg.com/images/themes/theme1/bg.png,http://pbs.twimg.com/profile_images/818887155338674176/CBrdC3Ts_normal.jpg
818649862967177216,1009621983611453441,2018-06-21T02:20:13Z,DeniseforAR,"Tender age shelters. 

If you still support Trump tonight, you will support him through any atrocity he commits. Looking at you, @PressSec.",Twitter for Android,139,,,,FALSE,TRUE,0,2,,,,,,,,,,,,,,67138500,AutumnDamnIt,en,,,,,,,,,,,,,,,,1009276604273569792,"Tender age shelters. 

If you still support Trump tonight, you will support him through any atrocity he commits. Looking at you, @PressSec.",2018-06-20T03:27:48Z,Twitter for iPhone,8,2,67138500,AutumnDamnIt,Autumn Tolbert,1054,1535,3759,"Fayetteville, AR",Political Columnist and Attorney/Link to my @ArkTimes columns below. I live in Arkansas.,FALSE,,,,,,,|,|,|||||||,https://twitter.com/DeniseforAR/status/1009621983611453441,Denise Garner,"Arkansas, USA","Retired Oncology Nurse, nonprofit founder, mother & grandma. Representative for Arkansas District 84. #Denisefor84",https://t.co/1hsAOCNvfd,FALSE,1844,725,27,764,3386,2017-01-10T02:45:11Z,FALSE,https://t.co/1hsAOCNvfd,http://denisegarner.com,en,https://pbs.twimg.com/profile_banners/818649862967177216/1514915839,http://abs.twimg.com/images/themes/theme1/bg.png,http://pbs.twimg.com/profile_images/818887155338674176/CBrdC3Ts_normal.jpg
818649862967177216,1009621526545657857,2018-06-21T02:18:24Z,DeniseforAR,hmmmm?!🤔 https://t.co/WQ7dGKd4wt,Twitter for Android,8,,,,TRUE,FALSE,10,1,,,twitter.com/gelderbailey/s…,https://t.co/WQ7dGKd4wt,https://twitter.com/gelderbailey/status/1009562828175499264,,,,,,,,,,,und,1009562828175499264,"If AR Republicans wanted to keep campuses safe, they would pass red flag laws. Instead, they push for more guns in more places, a strategy that’s proven to make us all LESS safe. Anyone else suspect our kids’ safety isn’t their main priority? #arleg #arpx  https://t.co/ir2CeON8LY",2018-06-20T22:25:09Z,Twitter for iPhone,25,9,801822229227065344,gelderbailey,unlikable,1392,1232,9508,"Little Rock, AR","Busybody. Pantsuit enthusiast. Disgusted and appalled, but working really hard to fix it.",FALSE,,,,,,,,,,,,,,,,,,,,,,|,|,|||||||,https://twitter.com/DeniseforAR/status/1009621526545657857,Denise Garner,"Arkansas, USA","Retired Oncology Nurse, nonprofit founder, mother & grandma. Representative for Arkansas District 84. #Denisefor84",https://t.co/1hsAOCNvfd,FALSE,1844,725,27,764,3386,2017-01-10T02:45:11Z,FALSE,https://t.co/1hsAOCNvfd,http://denisegarner.com,en,https://pbs.twimg.com/profile_banners/818649862967177216/1514915839,http://abs.twimg.com/images/themes/theme1/bg.png,http://pbs.twimg.com/profile_images/818887155338674176/CBrdC3Ts_normal.jpg
818649862967177216,1009621334031257600,2018-06-21T02:17:38Z,DeniseforAR,"President Trump’s lack of ethics and morals and his determination to make my country something she has never been has finally killed my sanguine attitude. We have serious and important work to do, people",Twitter for Android,139,,,,FALSE,TRUE,0,6,,,,,,,,,,,,,,701660532,lynndonaldcarve,en,,,,,,,,,,,,,,,,1009607046562533377,"President Trump’s lack of ethics and morals and his determination to make my country something she has never been has finally killed my sanguine attitude. We have serious and important work to do, people",2018-06-21T01:20:52Z,Twitter for iPhone,15,6,701660532,lynndonaldcarve,Lynn Donald Carver,101,165,336,"","",FALSE,,,,,,,|,|,|||||||,https://twitter.com/DeniseforAR/status/1009621334031257600,Denise Garner,"Arkansas, USA","Retired Oncology Nurse, nonprofit founder, mother & grandma. Representative for Arkansas District 84. #Denisefor84",https://t.co/1hsAOCNvfd,FALSE,1844,725,27,764,3386,2017-01-10T02:45:11Z,FALSE,https://t.co/1hsAOCNvfd,http://denisegarner.com,en,https://pbs.twimg.com/profile_banners/818649862967177216/1514915839,http://abs.twimg.com/images/themes/theme1/bg.png,http://pbs.twimg.com/profile_images/818887155338674176/CBrdC3Ts_normal.jpg
818649862967177216,1009230635964207104,2018-06-20T00:25:08Z,DeniseforAR,"Tonight, we met some wonderful ppl in the Copper Creek neighborhood. It was a privilege to hear from voters in Dist. 84 about their concerns &amp; issues facing their families.

We don’t need partisan extremism. I pledge to listen. Everybody in Dist. 84 will have a voice at the table https://t.co/9cOasCKaVM",Twitter for iPhone,284,,,,FALSE,FALSE,10,1,,,,,,http://pbs.twimg.com/media/DgGB5-aU8AA1mvQ.jpg,https://t.co/9cOasCKaVM,https://twitter.com/DeniseforAR/status/1009230635964207104/photo/1,photo,http://pbs.twimg.com/media/DgGB5-aU8AA1mvQ.jpg|http://pbs.twimg.com/media/DgGB5-bUwAA_Uol.jpg|http://pbs.twimg.com/media/DgGB5-dVQAASExu.jpg|http://pbs.twimg.com/media/DgGB5-bVMAAiSfg.jpg,https://t.co/9cOasCKaVM|https://t.co/9cOasCKaVM|https://t.co/9cOasCKaVM|https://t.co/9cOasCKaVM,https://twitter.com/DeniseforAR/status/1009230635964207104/photo/1|https://twitter.com/DeniseforAR/status/1009230635964207104/photo/1|https://twitter.com/DeniseforAR/status/1009230635964207104/photo/1|https://twitter.com/DeniseforAR/status/1009230635964207104/photo/1,,,,en,,,,,,,,,,,,,,,,,,,,,,,,,,,,,,,,,,,,,|,|,|||||||,https://twitter.com/DeniseforAR/status/1009230635964207104,Denise Garner,"Arkansas, USA","Retired Oncology Nurse, nonprofit founder, mother & grandma. Representative for Arkansas District 84. #Denisefor84",https://t.co/1hsAOCNvfd,FALSE,1844,725,27,764,3386,2017-01-10T02:45:11Z,FALSE,https://t.co/1hsAOCNvfd,http://denisegarner.com,en,https://pbs.twimg.com/profile_banners/818649862967177216/1514915839,http://abs.twimg.com/images/themes/theme1/bg.png,http://pbs.twimg.com/profile_images/818887155338674176/CBrdC3Ts_normal.jpg
818649862967177216,1009159594554294273,2018-06-19T19:42:51Z,DeniseforAR,"How long are we going to try an economic policy that supports CEO's on the backs of those who need govt services?? As the income gap shows,  IT DOESN'T WORK!!
#VoteWomackOut
@joshuamahony https://t.co/TQYqvZXzTk",Twitter for Android,211,,,,FALSE,FALSE,19,6,VoteWomackOut,,rollcall.com/news/policy/ho…,https://t.co/TQYqvZXzTk,https://www.rollcall.com/news/policy/house-budget-direct-302-billion-10-year-spending-cuts?utm_source=rollcallafternoon&utm_medium=email&utm_campaign=newsletters&utm_content=051818&utm_source=rollcallafternoon&utm_medium=email&utm_campaign=newsletters&utm_content=051818,,,,,,,,,76038071,joshuamahony,en,,,,,,,,,,,,,,,,,,,,,,,,,,,,,,,,,,,,,|,|,|||||||,https://twitter.com/DeniseforAR/status/1009159594554294273,Denise Garner,"Arkansas, USA","Retired Oncology Nurse, nonprofit founder, mother & grandma. Representative for Arkansas District 84. #Denisefor84",https://t.co/1hsAOCNvfd,FALSE,1844,725,27,764,3386,2017-01-10T02:45:11Z,FALSE,https://t.co/1hsAOCNvfd,http://denisegarner.com,en,https://pbs.twimg.com/profile_banners/818649862967177216/1514915839,http://abs.twimg.com/images/themes/theme1/bg.png,http://pbs.twimg.com/profile_images/818887155338674176/CBrdC3Ts_normal.jpg
