818649862967177216,1020029234998398977,2018-07-19T19:34:55Z,DeniseforAR,"""they are directing a majority of the windfall 2 investors and chief executives, who tend 2 have lg stock-based compensation packages.""

Low unemployment numbers mean nothing if it takes 3 jobs for 1 income. 

https://t.co/iL3f3sDtiL",Twitter for Android,233,,,,FALSE,FALSE,19,9,,,nyti.ms/2LkdKCo,https://t.co/iL3f3sDtiL,https://nyti.ms/2LkdKCo,,,,,,,,,,,en,,,,,,,,,,,,,,,,,,,,,,,,,,,,,,,,,,,,,|,|,|||||||,https://twitter.com/DeniseforAR/status/1020029234998398977,Denise Garner,"Arkansas, USA","Retired Oncology Nurse, nonprofit founder, mother & grandma. Representative for Arkansas District 84. #Denisefor84",https://t.co/1hsAOCNvfd,FALSE,1844,725,27,764,3386,2017-01-10T02:45:11Z,FALSE,https://t.co/1hsAOCNvfd,http://denisegarner.com,en,https://pbs.twimg.com/profile_banners/818649862967177216/1514915839,http://abs.twimg.com/images/themes/theme1/bg.png,http://pbs.twimg.com/profile_images/818887155338674176/CBrdC3Ts_normal.jpg
818649862967177216,1020024152957366274,2018-07-19T19:14:43Z,DeniseforAR,At the meeting of the NWA Democrats today Madison Co Chairman Derek Donahou was able to visit with @DeniseforAR and discuss her plans to unseat Rep. Collins and put AR first! Everyone get loud and support Denise Garner for State Rep! She is willing to listen and willing to work! https://t.co/eIe4YG9aZt,Twitter for Android,140,,,,FALSE,TRUE,0,6,,,,,,,,,,,,,,957001367058558981|818649862967177216,MadisonDemsAR|DeniseforAR,en,,,,,,,,,,,,,,,,1019326055981764609,At the meeting of the NWA Democrats today Madison Co Chairman Derek Donahou was able to visit with @DeniseforAR and discuss her plans to unseat Rep. Collins and put AR first! Everyone get loud and support Denise Garner for State Rep! She is willing to listen and willing to work! https://t.co/eIe4YG9aZt,2018-07-17T21:00:44Z,Twitter for iPhone,18,6,957001367058558981,MadisonDemsAR,Democrats of Madison County,166,352,245,"Madison County, AR","This is the official Twitter feed of the Madison County Democratic Central Committee. 
Account managed by Chairman Derek Donahou.",FALSE,,,,,,,|,|,|||||||,https://twitter.com/DeniseforAR/status/1020024152957366274,Denise Garner,"Arkansas, USA","Retired Oncology Nurse, nonprofit founder, mother & grandma. Representative for Arkansas District 84. #Denisefor84",https://t.co/1hsAOCNvfd,FALSE,1844,725,27,764,3386,2017-01-10T02:45:11Z,FALSE,https://t.co/1hsAOCNvfd,http://denisegarner.com,en,https://pbs.twimg.com/profile_banners/818649862967177216/1514915839,http://abs.twimg.com/images/themes/theme1/bg.png,http://pbs.twimg.com/profile_images/818887155338674176/CBrdC3Ts_normal.jpg
818649862967177216,1020023694922592256,2018-07-19T19:12:54Z,DeniseforAR,@CollinsARK Why would you purposely lie about your opponent Charlie?  @DeniseforAR has been given the @MomsDemand stamp of approval for being a gun sense candidate.  I know that distinction bothers you &amp; counteract it by saying she’s a gun control candidate.  Sad &amp; Pathetic.,Twitter for Android,140,,,,FALSE,TRUE,0,10,,,,,,,,,,,,,,268624991|108117069|818649862967177216|1017637447,ShopSoarBlue|CollinsARK|DeniseforAR|MomsDemand,en,,,,,,,,,,,,,,,,1019410555831046144,@CollinsARK Why would you purposely lie about your opponent Charlie?  @DeniseforAR has been given the @MomsDemand stamp of approval for being a gun sense candidate.  I know that distinction bothers you &amp; counteract it by saying she’s a gun control candidate.  Sad &amp; Pathetic.,2018-07-18T02:36:30Z,Twitter for iPhone,28,10,268624991,ShopSoarBlue,Kevin L. Harvey,7347,7216,8104,"Fayetteville, Arkansas","Founder of SoarBlue, a Designer Democratic Apparel Co, focused on influencing others to join the blue team & giving back to causes that are close to blue 💙’s.",FALSE,,,,,,,|,|,|||||||,https://twitter.com/DeniseforAR/status/1020023694922592256,Denise Garner,"Arkansas, USA","Retired Oncology Nurse, nonprofit founder, mother & grandma. Representative for Arkansas District 84. #Denisefor84",https://t.co/1hsAOCNvfd,FALSE,1844,725,27,764,3386,2017-01-10T02:45:11Z,FALSE,https://t.co/1hsAOCNvfd,http://denisegarner.com,en,https://pbs.twimg.com/profile_banners/818649862967177216/1514915839,http://abs.twimg.com/images/themes/theme1/bg.png,http://pbs.twimg.com/profile_images/818887155338674176/CBrdC3Ts_normal.jpg
818649862967177216,1019769131401392128,2018-07-19T02:21:21Z,DeniseforAR,"How is this good, @CollinsARK ? https://t.co/fsB8u2X57r",Twitter for iPhone,74,,,,FALSE,TRUE,0,11,,,twitter.com/jesselehrich/s…,https://t.co/fsB8u2X57r,https://twitter.com/jesselehrich/status/1004529426154041344,,,,,,,,,1327956991|108117069,BlueHogReport|CollinsARK,en,,,,,,,,,,,,,,,,1019578267391709184,"How is this good, @CollinsARK ? https://t.co/fsB8u2X57r",2018-07-18T13:42:56Z,Twitter for iPhone,36,11,1327956991,BlueHogReport,Blue Hog Report,3959,3600,7192,"Little Rock, AR",Real Gs move in silence like lasagna.,FALSE,,,,,,,|,|,|||||||,https://twitter.com/DeniseforAR/status/1019769131401392128,Denise Garner,"Arkansas, USA","Retired Oncology Nurse, nonprofit founder, mother & grandma. Representative for Arkansas District 84. #Denisefor84",https://t.co/1hsAOCNvfd,FALSE,1844,725,27,764,3386,2017-01-10T02:45:11Z,FALSE,https://t.co/1hsAOCNvfd,http://denisegarner.com,en,https://pbs.twimg.com/profile_banners/818649862967177216/1514915839,http://abs.twimg.com/images/themes/theme1/bg.png,http://pbs.twimg.com/profile_images/818887155338674176/CBrdC3Ts_normal.jpg
818649862967177216,1019590412753883136,2018-07-18T14:31:12Z,DeniseforAR,"Better late than never, but what took so long?  #TimeForEthicalLeadership  #arleg #arpx 

https://t.co/wrdcpAjPZA",Twitter for iPhone,113,,,,FALSE,FALSE,38,3,TimeForEthicalLeadership|arleg|arpx,,m.arkansasonline.com/news/2018/jul/…,https://t.co/wrdcpAjPZA,http://m.arkansasonline.com/news/2018/jul/18/governor-calls-for-legislator-to-resign/,,,,,,,,,,,en,,,,,,,,,,,,,,,,,,,,,,,,,,,,,,,,,,,,,|,|,|||||||,https://twitter.com/DeniseforAR/status/1019590412753883136,Denise Garner,"Arkansas, USA","Retired Oncology Nurse, nonprofit founder, mother & grandma. Representative for Arkansas District 84. #Denisefor84",https://t.co/1hsAOCNvfd,FALSE,1844,725,27,764,3386,2017-01-10T02:45:11Z,FALSE,https://t.co/1hsAOCNvfd,http://denisegarner.com,en,https://pbs.twimg.com/profile_banners/818649862967177216/1514915839,http://abs.twimg.com/images/themes/theme1/bg.png,http://pbs.twimg.com/profile_images/818887155338674176/CBrdC3Ts_normal.jpg
818649862967177216,1019413807377022981,2018-07-18T02:49:26Z,DeniseforAR,@ShopSoarBlue @CollinsARK @MomsDemand He’s feeling the heat &amp; about to get outta the kitchen #HeatWave,Twitter for iPhone,68,1019410555831046144,268624991,ShopSoarBlue,FALSE,FALSE,16,0,HeatWave,,,,,,,,,,,,,268624991|108117069|1017637447,ShopSoarBlue|CollinsARK|MomsDemand,en,,,,,,,,,,,,,,,,,,,,,,,,,,,,,,,,,,,,,|,|,|||||||,https://twitter.com/DeniseforAR/status/1019413807377022981,Denise Garner,"Arkansas, USA","Retired Oncology Nurse, nonprofit founder, mother & grandma. Representative for Arkansas District 84. #Denisefor84",https://t.co/1hsAOCNvfd,FALSE,1844,725,27,764,3386,2017-01-10T02:45:11Z,FALSE,https://t.co/1hsAOCNvfd,http://denisegarner.com,en,https://pbs.twimg.com/profile_banners/818649862967177216/1514915839,http://abs.twimg.com/images/themes/theme1/bg.png,http://pbs.twimg.com/profile_images/818887155338674176/CBrdC3Ts_normal.jpg
818649862967177216,1019395317987463168,2018-07-18T01:35:57Z,DeniseforAR,@self_fulfilling Thank you Weston! I appreciate you! 🤗❤️❤️🤗,Twitter for iPhone,42,1019394302856908801,355788985,self_fulfilling,FALSE,FALSE,3,0,,,,,,,,,,,,,,355788985,self_fulfilling,en,,,,,,,,,,,,,,,,,,,,,,,,,,,,,,,,,,,,,|,|,|||||||,https://twitter.com/DeniseforAR/status/1019395317987463168,Denise Garner,"Arkansas, USA","Retired Oncology Nurse, nonprofit founder, mother & grandma. Representative for Arkansas District 84. #Denisefor84",https://t.co/1hsAOCNvfd,FALSE,1844,725,27,764,3386,2017-01-10T02:45:11Z,FALSE,https://t.co/1hsAOCNvfd,http://denisegarner.com,en,https://pbs.twimg.com/profile_banners/818649862967177216/1514915839,http://abs.twimg.com/images/themes/theme1/bg.png,http://pbs.twimg.com/profile_images/818887155338674176/CBrdC3Ts_normal.jpg
818649862967177216,1019391797733322752,2018-07-18T01:21:58Z,DeniseforAR,"HB1243 was 2013, the one you co-sponsored with Sen. Jon Woods. You didn’t listen to ANY public college or university on that bill either. 

But you &amp; Sen. Woods did listen to private Ecclesia College in 2013 with thousands in public GIF money. #SorryCharlie #WrongPriorities #arpx https://t.co/n9tQTOr0Q8",Twitter for iPhone,284,,,,TRUE,FALSE,53,12,SorryCharlie|WrongPriorities|arpx,,twitter.com/collinsark/sta…,https://t.co/n9tQTOr0Q8,https://twitter.com/collinsark/status/1019382412286091264,,,,,,,,,,,en,1019382412286091264,"You got me Denise. 1243 was number in a prior session. I introduced Campus Carry to protect our #arpx loved ones in 2011, 13, 15 &amp; then 17 &amp; I get number mixed up. I understand that you are a strong pro gun control candidate, so voters have clear choice on issue of gun control. https://t.co/6fDZafg6j2",2018-07-18T00:44:40Z,Twitter for Android,0,1,108117069,CollinsARK,Charlie Collins,5142,3624,23413,"Washington County, Arkansas",Arkansas,FALSE,,,,,,,,,,,,,,,,,,,,,,|,|,|||||||,https://twitter.com/DeniseforAR/status/1019391797733322752,Denise Garner,"Arkansas, USA","Retired Oncology Nurse, nonprofit founder, mother & grandma. Representative for Arkansas District 84. #Denisefor84",https://t.co/1hsAOCNvfd,FALSE,1844,725,27,764,3386,2017-01-10T02:45:11Z,FALSE,https://t.co/1hsAOCNvfd,http://denisegarner.com,en,https://pbs.twimg.com/profile_banners/818649862967177216/1514915839,http://abs.twimg.com/images/themes/theme1/bg.png,http://pbs.twimg.com/profile_images/818887155338674176/CBrdC3Ts_normal.jpg
818649862967177216,1019369821199269888,2018-07-17T23:54:39Z,DeniseforAR,"Sorry Charlie, if you had listened to your constituents instead of allowing the NRA to write HB1249, you might remember the bill number correctly. It’s gonna be one of the first pieces of legislation we overturn next session. #arpx #arleg #KnowYourFacts #ListenToYourVoters https://t.co/bSPH6B10xW",Twitter for iPhone,273,,,,TRUE,FALSE,91,21,arpx|arleg|KnowYourFacts|ListenToYourVoters,,twitter.com/collinsark/sta…,https://t.co/bSPH6B10xW,https://twitter.com/collinsark/status/1019364386908012544,,,,,,,,,,,en,1019364386908012544,Here's the reality. My orig version #arleg HB1243 got 70 of 100 house votes. Then Senate amended it &amp; I got 70 votes again on amended version. Then I passed SB724 (stadium exemption) with 70 votes. Repeated 70-30 vote margins = working with others. #arpx https://t.co/LYdeci0arP,2018-07-17T23:33:03Z,Twitter for Android,2,0,108117069,CollinsARK,Charlie Collins,5142,3624,23413,"Washington County, Arkansas",Arkansas,FALSE,,,,,,,,,,,,,,,,,,,,,,|,|,|||||||,https://twitter.com/DeniseforAR/status/1019369821199269888,Denise Garner,"Arkansas, USA","Retired Oncology Nurse, nonprofit founder, mother & grandma. Representative for Arkansas District 84. #Denisefor84",https://t.co/1hsAOCNvfd,FALSE,1844,725,27,764,3386,2017-01-10T02:45:11Z,FALSE,https://t.co/1hsAOCNvfd,http://denisegarner.com,en,https://pbs.twimg.com/profile_banners/818649862967177216/1514915839,http://abs.twimg.com/images/themes/theme1/bg.png,http://pbs.twimg.com/profile_images/818887155338674176/CBrdC3Ts_normal.jpg
818649862967177216,1018533077113597952,2018-07-15T16:29:43Z,DeniseforAR,Who's running against this guy? I'll help... #NotMyUSA https://t.co/tOQvFu1hOw,Twitter for Android,54,,,,TRUE,FALSE,31,6,NotMyUSA,,twitter.com/dbishop0/statu…,https://t.co/tOQvFu1hOw,https://twitter.com/dbishop0/status/1018341139294949377,,,,,,,,,,,en,1018341139294949377,"Money talks, and our Senator is a mouthpiece for these special interests. #arpx https://t.co/OZx4YA17X0",2018-07-15T03:47:02Z,Twitter for iPhone,83,55,171618678,dbishop0,Daniel Bishop,1687,2615,8641,"Arkansas, USA","Doing what I can, where I can.",FALSE,,,,,,,,,,,,,,,,,,,,,,|,|,|||||||,https://twitter.com/DeniseforAR/status/1018533077113597952,Denise Garner,"Arkansas, USA","Retired Oncology Nurse, nonprofit founder, mother & grandma. Representative for Arkansas District 84. #Denisefor84",https://t.co/1hsAOCNvfd,FALSE,1844,725,27,764,3386,2017-01-10T02:45:11Z,FALSE,https://t.co/1hsAOCNvfd,http://denisegarner.com,en,https://pbs.twimg.com/profile_banners/818649862967177216/1514915839,http://abs.twimg.com/images/themes/theme1/bg.png,http://pbs.twimg.com/profile_images/818887155338674176/CBrdC3Ts_normal.jpg
818649862967177216,1018526041487405056,2018-07-15T16:01:46Z,DeniseforAR,"This is abhorrent. I'm so proud of @joshuamahony, @clarketucker, @DecideonDesai, and @HaydenShamel for stepping up to make this country kind, moral, ethical...again. Republicans who are not standing vs 45 are complicit. 
#NotMyUSA https://t.co/AS9kquFJg1",Twitter for Android,230,,,,TRUE,FALSE,50,26,NotMyUSA,,twitter.com/KathyLWebb/sta…,https://t.co/AS9kquFJg1,https://twitter.com/KathyLWebb/status/1018488637233786880,,,,,,,,,76038071|275048169|929860720359084032|2857461284,joshuamahony|clarketucker|DecideonDesai|HaydenShamel,en,1018488637233786880,"Siblings in “detention” not allowed 2 hug or touch even their siblings. No mail. Injections. 2,800 children still separated. ⁦@nytimes⁩ ⁦@PressSec⁩ https://t.co/qePVQc8f9n",2018-07-15T13:33:08Z,Twitter for iPhone,22,10,17459358,KathyLWebb,Kathy Webb,3332,643,6364,"Little Rock, AR","Devoted aunt/great-aunt. PK/Christian/feminist/progressive/LGBT. Cancer survivor. Love 🐕 🍿🐈 📖 ⚾️ ED AR Hunger Relief Alliance; City Director, Ward 3, LR.",FALSE,,,,,,,,,,,,,,,,,,,,,,|,|,|||||||,https://twitter.com/DeniseforAR/status/1018526041487405056,Denise Garner,"Arkansas, USA","Retired Oncology Nurse, nonprofit founder, mother & grandma. Representative for Arkansas District 84. #Denisefor84",https://t.co/1hsAOCNvfd,FALSE,1844,725,27,764,3386,2017-01-10T02:45:11Z,FALSE,https://t.co/1hsAOCNvfd,http://denisegarner.com,en,https://pbs.twimg.com/profile_banners/818649862967177216/1514915839,http://abs.twimg.com/images/themes/theme1/bg.png,http://pbs.twimg.com/profile_images/818887155338674176/CBrdC3Ts_normal.jpg
818649862967177216,1018207517325824003,2018-07-14T18:56:04Z,DeniseforAR,"H.S. principals don’t want guns in their schools. It’s weird how AR legislators invite fake experts to talk about this but parents, teachers, school nurses and child psychologists who showed up got no say. We’ll be back  with receipts! Here’s one. #arpx  https://t.co/XKgywNmn8e",Twitter for Android,140,,,,FALSE,TRUE,0,47,,,,,,,,,,,,,,801822229227065344,gelderbailey,en,,,,,,,,,,,,,,,,1017962054823669760,"H.S. principals don’t want guns in their schools. It’s weird how AR legislators invite fake experts to talk about this but parents, teachers, school nurses and child psychologists who showed up got no say. We’ll be back  with receipts! Here’s one. #arpx  https://t.co/XKgywNmn8e",2018-07-14T02:40:41Z,Twitter for iPhone,128,47,801822229227065344,gelderbailey,unlikable,1392,1232,9508,"Little Rock, AR","Busybody. Pantsuit enthusiast. Disgusted and appalled, but working really hard to fix it.",FALSE,,,,,,,|,|,|||||||,https://twitter.com/DeniseforAR/status/1018207517325824003,Denise Garner,"Arkansas, USA","Retired Oncology Nurse, nonprofit founder, mother & grandma. Representative for Arkansas District 84. #Denisefor84",https://t.co/1hsAOCNvfd,FALSE,1844,725,27,764,3386,2017-01-10T02:45:11Z,FALSE,https://t.co/1hsAOCNvfd,http://denisegarner.com,en,https://pbs.twimg.com/profile_banners/818649862967177216/1514915839,http://abs.twimg.com/images/themes/theme1/bg.png,http://pbs.twimg.com/profile_images/818887155338674176/CBrdC3Ts_normal.jpg
818649862967177216,1017481383105761280,2018-07-12T18:50:40Z,DeniseforAR,This is too frightening for an already struggling economy and will affect ALL Arkansans...#VoteThemOut https://t.co/dSiwNsAdrQ,Twitter for Android,102,,,,TRUE,FALSE,26,7,VoteThemOut,,twitter.com/will_watson/st…,https://t.co/dSiwNsAdrQ,https://twitter.com/will_watson/status/1017387161258209281,,,,,,,,,,,en,1017387161258209281,"Wow. NPR reports that state chamber in Arkansas says Trump tariffs could mean a $339 MILLION hit to the state economy! Better get that Giant Jumbled Magnet fired up, @CollinsARK! Your president is doing everything he can to wreck #arpx economy.",2018-07-12T12:36:16Z,Twitter for iPhone,119,53,43380511,will_watson,Will Watson,2408,940,15116,"Fayetteville, AR","Let us step into the night and pursue that flighty temptress, adventure. ✨",FALSE,,,,,,,,,,,,,,,,,,,,,,|,|,|||||||,https://twitter.com/DeniseforAR/status/1017481383105761280,Denise Garner,"Arkansas, USA","Retired Oncology Nurse, nonprofit founder, mother & grandma. Representative for Arkansas District 84. #Denisefor84",https://t.co/1hsAOCNvfd,FALSE,1844,725,27,764,3386,2017-01-10T02:45:11Z,FALSE,https://t.co/1hsAOCNvfd,http://denisegarner.com,en,https://pbs.twimg.com/profile_banners/818649862967177216/1514915839,http://abs.twimg.com/images/themes/theme1/bg.png,http://pbs.twimg.com/profile_images/818887155338674176/CBrdC3Ts_normal.jpg
818649862967177216,1017455567751741440,2018-07-12T17:08:05Z,DeniseforAR,"How low can he go? #SorryCharlie, we want you out. @DeniseforAR understands what parents and teachers want. #BlueWave 🌊🌊🌊 https://t.co/kcGw4IyRPm",Twitter for Android,140,,,,FALSE,TRUE,0,4,SorryCharlie|BlueWave,,,,,,,,,,,,,197640217|818649862967177216,LRLolly|DeniseforAR,en,,,,,,,,,,,,,,,,1017419990230855680,"How low can he go? #SorryCharlie, we want you out. @DeniseforAR understands what parents and teachers want. #BlueWave 🌊🌊🌊 https://t.co/kcGw4IyRPm",2018-07-12T14:46:43Z,Twitter Web Client,16,4,197640217,LRLolly,LauraCartwrightHardy,836,1696,7695,"Little Rock, Ark., U.S.","Writer, activist. Five grandkids call me Lolly. I do believe in rock ’n’ roll. All tweets, of course, are my own. #momsdemandaction #resist #NotNormal",FALSE,,,,,,,|,|,|||||||,https://twitter.com/DeniseforAR/status/1017455567751741440,Denise Garner,"Arkansas, USA","Retired Oncology Nurse, nonprofit founder, mother & grandma. Representative for Arkansas District 84. #Denisefor84",https://t.co/1hsAOCNvfd,FALSE,1844,725,27,764,3386,2017-01-10T02:45:11Z,FALSE,https://t.co/1hsAOCNvfd,http://denisegarner.com,en,https://pbs.twimg.com/profile_banners/818649862967177216/1514915839,http://abs.twimg.com/images/themes/theme1/bg.png,http://pbs.twimg.com/profile_images/818887155338674176/CBrdC3Ts_normal.jpg
818649862967177216,1017455443109728256,2018-07-12T17:07:35Z,DeniseforAR,"Fayetteville people in District 84, please for the love of God, vote this guy out.  @DeniseforAR is a great candidate, and doesn't want to give guns to kids.  You can figure out your district on this website.  https://t.co/1GB0CcFC7p
 
PLEASE VOTE. https://t.co/lTWwK0d5xI",Twitter for Android,140,,,,FALSE,TRUE,0,55,,,,,,,,,,,,,,250987379|818649862967177216,TuckerPartridge|DeniseforAR,en,,,,,,,,,,,,,,,,1017442875771105282,"Fayetteville people in District 84, please for the love of God, vote this guy out.  @DeniseforAR is a great candidate, and doesn't want to give guns to kids.  You can figure out your district on this website.  https://t.co/1GB0CcFC7p
 
PLEASE VOTE. https://t.co/lTWwK0d5xI",2018-07-12T16:17:39Z,Twitter Web Client,168,55,250987379,TuckerPartridge,Tuck,424,408,5167,in a pear tree,number 6 bass player in the world on Rock Band 4 for the song “Nights on Broadway” by The Bee Gees,FALSE,,,,,,,|,|,|||||||,https://twitter.com/DeniseforAR/status/1017455443109728256,Denise Garner,"Arkansas, USA","Retired Oncology Nurse, nonprofit founder, mother & grandma. Representative for Arkansas District 84. #Denisefor84",https://t.co/1hsAOCNvfd,FALSE,1844,725,27,764,3386,2017-01-10T02:45:11Z,FALSE,https://t.co/1hsAOCNvfd,http://denisegarner.com,en,https://pbs.twimg.com/profile_banners/818649862967177216/1514915839,http://abs.twimg.com/images/themes/theme1/bg.png,http://pbs.twimg.com/profile_images/818887155338674176/CBrdC3Ts_normal.jpg
818649862967177216,1017454927281623040,2018-07-12T17:05:32Z,DeniseforAR,Hopefully not for much longer- @DeniseforAR is going to take him out. https://t.co/GM7spKZ2AD,Twitter for Android,113,,,,FALSE,TRUE,0,75,,,twitter.com/shannonrwatts/…,https://t.co/GM7spKZ2AD,https://twitter.com/shannonrwatts/status/1017173673466200064,,,,,,,,,750862429161132032|818649862967177216,chelseasmiller|DeniseforAR,en,,,,,,,,,,,,,,,,1017419059896442880,Hopefully not for much longer- @DeniseforAR is going to take him out. https://t.co/GM7spKZ2AD,2018-07-12T14:43:01Z,Twitter Web Client,376,75,750862429161132032,chelseasmiller,Chelsea S Miller,1425,1834,1855,"Arkansas, USA",Proud millennial woman seeking to empower other women and find the best oat milk latte.,FALSE,,,,,,,|,|,|||||||,https://twitter.com/DeniseforAR/status/1017454927281623040,Denise Garner,"Arkansas, USA","Retired Oncology Nurse, nonprofit founder, mother & grandma. Representative for Arkansas District 84. #Denisefor84",https://t.co/1hsAOCNvfd,FALSE,1844,725,27,764,3386,2017-01-10T02:45:11Z,FALSE,https://t.co/1hsAOCNvfd,http://denisegarner.com,en,https://pbs.twimg.com/profile_banners/818649862967177216/1514915839,http://abs.twimg.com/images/themes/theme1/bg.png,http://pbs.twimg.com/profile_images/818887155338674176/CBrdC3Ts_normal.jpg
818649862967177216,1017249276907393025,2018-07-12T03:28:21Z,DeniseforAR,We deserve better. We can elect better. @DeniseforAR #GunSenseCandidate #arleg https://t.co/osQMpfg0R1,Twitter for Android,116,,,,FALSE,TRUE,0,18,GunSenseCandidate|arleg,,twitter.com/shannonrwatts/…,https://t.co/osQMpfg0R1,https://twitter.com/shannonrwatts/status/1017173673466200064,,,,,,,,,171618678|818649862967177216,dbishop0|DeniseforAR,en,,,,,,,,,,,,,,,,1017234114448183296,We deserve better. We can elect better. @DeniseforAR #GunSenseCandidate #arleg https://t.co/osQMpfg0R1,2018-07-12T02:28:06Z,Twitter for iPhone,58,18,171618678,dbishop0,Daniel Bishop,1687,2615,8641,"Arkansas, USA","Doing what I can, where I can.",FALSE,,,,,,,|,|,|||||||,https://twitter.com/DeniseforAR/status/1017249276907393025,Denise Garner,"Arkansas, USA","Retired Oncology Nurse, nonprofit founder, mother & grandma. Representative for Arkansas District 84. #Denisefor84",https://t.co/1hsAOCNvfd,FALSE,1844,725,27,764,3386,2017-01-10T02:45:11Z,FALSE,https://t.co/1hsAOCNvfd,http://denisegarner.com,en,https://pbs.twimg.com/profile_banners/818649862967177216/1514915839,http://abs.twimg.com/images/themes/theme1/bg.png,http://pbs.twimg.com/profile_images/818887155338674176/CBrdC3Ts_normal.jpg
818649862967177216,1017198284107079680,2018-07-12T00:05:44Z,DeniseforAR,@shannonrwatts America you have NO idea how unqualified this guy is to be representing anyone or anything.  I’m a constituent of his &amp; we’re working incredibly hard to vote him out of office!  @DeniseforAR is running against him &amp; will win come November 6th! (She’s a Gun Sense Candidate!),Twitter for Android,140,,,,FALSE,TRUE,0,9,,,,,,,,,,,,,,268624991|246939630,ShopSoarBlue|shannonrwatts,en,,,,,,,,,,,,,,,,1017197112700874755,@shannonrwatts America you have NO idea how unqualified this guy is to be representing anyone or anything.  I’m a constituent of his &amp; we’re working incredibly hard to vote him out of office!  @DeniseforAR is running against him &amp; will win come November 6th! (She’s a Gun Sense Candidate!),2018-07-12T00:01:04Z,Twitter for iPhone,83,9,268624991,ShopSoarBlue,Kevin L. Harvey,7347,7216,8104,"Fayetteville, Arkansas","Founder of SoarBlue, a Designer Democratic Apparel Co, focused on influencing others to join the blue team & giving back to causes that are close to blue 💙’s.",FALSE,,,,,,,|,|,|||||||,https://twitter.com/DeniseforAR/status/1017198284107079680,Denise Garner,"Arkansas, USA","Retired Oncology Nurse, nonprofit founder, mother & grandma. Representative for Arkansas District 84. #Denisefor84",https://t.co/1hsAOCNvfd,FALSE,1844,725,27,764,3386,2017-01-10T02:45:11Z,FALSE,https://t.co/1hsAOCNvfd,http://denisegarner.com,en,https://pbs.twimg.com/profile_banners/818649862967177216/1514915839,http://abs.twimg.com/images/themes/theme1/bg.png,http://pbs.twimg.com/profile_images/818887155338674176/CBrdC3Ts_normal.jpg
818649862967177216,1017077684290105344,2018-07-11T16:06:30Z,DeniseforAR,"This is so unacceptable on so many levels. I don’t even know where to start.  
https://t.co/sDI2OTWxee https://t.co/dv0TZR1H7f",Twitter for Android,140,,,,FALSE,TRUE,0,6253,,,slate.com/news-and-polit…,https://t.co/sDI2OTWxee,https://slate.com/news-and-politics/2018/07/trumps-office-of-refugee-resettlement-is-budgeting-for-a-surge-in-child-separations.html,,,,,,,,,248735463,RepBarbaraLee,en,,,,,,,,,,,,,,,,1016772692408750082,"This is so unacceptable on so many levels. I don’t even know where to start.  
https://t.co/sDI2OTWxee https://t.co/dv0TZR1H7f",2018-07-10T19:54:35Z,Twitter Web Client,10098,6253,248735463,RepBarbaraLee,Rep. Barbara Lee,224163,16321,9011,"Washington, DC and Oakland, CA","Progressive Democrat representing the #EastBay. Promoting justice for all, peace, & human rights. @ProChoiceCaucus Co-Chair. Proud member of the #resistance.",TRUE,,,,,,,|,|,|||||||,https://twitter.com/DeniseforAR/status/1017077684290105344,Denise Garner,"Arkansas, USA","Retired Oncology Nurse, nonprofit founder, mother & grandma. Representative for Arkansas District 84. #Denisefor84",https://t.co/1hsAOCNvfd,FALSE,1844,725,27,764,3386,2017-01-10T02:45:11Z,FALSE,https://t.co/1hsAOCNvfd,http://denisegarner.com,en,https://pbs.twimg.com/profile_banners/818649862967177216/1514915839,http://abs.twimg.com/images/themes/theme1/bg.png,http://pbs.twimg.com/profile_images/818887155338674176/CBrdC3Ts_normal.jpg
