818649862967177216,1043532596272087040,2018-09-22T16:08:53Z,DeniseforAR,"We’re sending out dozens of volunteers to canvass for @DeniseforAR, @joshuamahony, @JaredforGov, @gregleding &amp; all our great @WashCoDemocrats candidates. 

Overheard:
“We’re gonna knock so many doors!” 
“This is my first time knocking! I’m so excited!” #arpx https://t.co/hSywJCdoE6",Twitter for iPhone,144,,,,FALSE,TRUE,0,13,,,,,,,,,,,,,,43380511|818649862967177216|76038071|938873003617726466|28375536,will_watson|DeniseforAR|joshuamahony|JaredforGov|GregLeding,en,,,,,,,,,,,,,,,,1043518965987848192,"We’re sending out dozens of volunteers to canvass for @DeniseforAR, @joshuamahony, @JaredforGov, @gregleding &amp; all our great @WashCoDemocrats candidates. 

Overheard:
“We’re gonna knock so many doors!” 
“This is my first time knocking! I’m so excited!” #arpx https://t.co/hSywJCdoE6",2018-09-22T15:14:43Z,Twitter for iPhone,41,13,43380511,will_watson,Will Watson,2408,940,15116,"Fayetteville, AR","Let us step into the night and pursue that flighty temptress, adventure. ✨",FALSE,,,,,,,|,|,|||||||,https://twitter.com/DeniseforAR/status/1043532596272087040,Denise Garner,"Arkansas, USA","Retired Oncology Nurse, nonprofit founder, mother & grandma. Representative for Arkansas District 84. #Denisefor84",https://t.co/1hsAOCNvfd,FALSE,1844,725,27,764,3386,2017-01-10T02:45:11Z,FALSE,https://t.co/1hsAOCNvfd,http://denisegarner.com,en,https://pbs.twimg.com/profile_banners/818649862967177216/1514915839,http://abs.twimg.com/images/themes/theme1/bg.png,http://pbs.twimg.com/profile_images/818887155338674176/CBrdC3Ts_normal.jpg
818649862967177216,1043141919558258688,2018-09-21T14:16:28Z,DeniseforAR,"Charlie, this race is between you &amp; me. I don’t control what people say on Twitter. I just know what people are saying in Dist. 84. Those are the people you should care what they have to say. 

They are ready for change. They want a #arleg State Rep who will listen to them #arpx https://t.co/YjQ0AjISQg",Twitter for iPhone,283,,,,TRUE,FALSE,68,7,arleg|arpx,,twitter.com/CollinsARK/sta…,https://t.co/YjQ0AjISQg,https://twitter.com/CollinsARK/status/1043130084645916673,,,,,,,,,,,en,1043130084645916673,"What surprises me isn't how liberal my opponent is (her liberal progressive #arpx policy agenda was clear from her Dem party activism), but how she supports &amp; condones: 1. Her supporters insulting many of the people she wants to vote for her &amp; 2. Crude insults. https://t.co/t7kDesZyQX",2018-09-21T13:29:27Z,Twitter for Android,0,0,108117069,CollinsARK,Charlie Collins,5142,3624,23413,"Washington County, Arkansas",Arkansas,FALSE,,,,,,,,,,,,,,,,,,,,,,|,|,|||||||,https://twitter.com/DeniseforAR/status/1043141919558258688,Denise Garner,"Arkansas, USA","Retired Oncology Nurse, nonprofit founder, mother & grandma. Representative for Arkansas District 84. #Denisefor84",https://t.co/1hsAOCNvfd,FALSE,1844,725,27,764,3386,2017-01-10T02:45:11Z,FALSE,https://t.co/1hsAOCNvfd,http://denisegarner.com,en,https://pbs.twimg.com/profile_banners/818649862967177216/1514915839,http://abs.twimg.com/images/themes/theme1/bg.png,http://pbs.twimg.com/profile_images/818887155338674176/CBrdC3Ts_normal.jpg
818649862967177216,1042970654067310592,2018-09-21T02:55:56Z,DeniseforAR,"@JooBilly ""Messy vitality""",Twitter for Android,16,1042746967749738497,80908670,JooBilly,FALSE,FALSE,0,0,,,,,,,,,,,,,,80908670,JooBilly,en,,,,,,,,,,,,,,,,,,,,,,,,,,,,,,,,,,,,,|,|,|||||||,https://twitter.com/DeniseforAR/status/1042970654067310592,Denise Garner,"Arkansas, USA","Retired Oncology Nurse, nonprofit founder, mother & grandma. Representative for Arkansas District 84. #Denisefor84",https://t.co/1hsAOCNvfd,FALSE,1844,725,27,764,3386,2017-01-10T02:45:11Z,FALSE,https://t.co/1hsAOCNvfd,http://denisegarner.com,en,https://pbs.twimg.com/profile_banners/818649862967177216/1514915839,http://abs.twimg.com/images/themes/theme1/bg.png,http://pbs.twimg.com/profile_images/818887155338674176/CBrdC3Ts_normal.jpg
818649862967177216,1042938457537097728,2018-09-21T00:47:59Z,DeniseforAR,"No one owes you clarity, Charlie.  @DeniseforAR is busy building a grassroots campaign. 

@CollinsARK #arpx plan:
❌guns everywhere 
❌kick 4500 Arkansans off insurance
❌give away thousands to GIF scam
❌tax cuts for rich https://t.co/SnvGIG0ZT4",Twitter for iPhone,140,,,,FALSE,TRUE,0,6,arpx,,,,,,,,,,,,,43380511|818649862967177216|108117069,will_watson|DeniseforAR|CollinsARK,en,,,,,,,,,,,,,,,,1042935485402890240,"No one owes you clarity, Charlie.  @DeniseforAR is busy building a grassroots campaign. 

@CollinsARK #arpx plan:
❌guns everywhere 
❌kick 4500 Arkansans off insurance
❌give away thousands to GIF scam
❌tax cuts for rich https://t.co/SnvGIG0ZT4",2018-09-21T00:36:11Z,Twitter for iPhone,26,6,43380511,will_watson,Will Watson,2408,940,15116,"Fayetteville, AR","Let us step into the night and pursue that flighty temptress, adventure. ✨",FALSE,,,,,,,|,|,|||||||,https://twitter.com/DeniseforAR/status/1042938457537097728,Denise Garner,"Arkansas, USA","Retired Oncology Nurse, nonprofit founder, mother & grandma. Representative for Arkansas District 84. #Denisefor84",https://t.co/1hsAOCNvfd,FALSE,1844,725,27,764,3386,2017-01-10T02:45:11Z,FALSE,https://t.co/1hsAOCNvfd,http://denisegarner.com,en,https://pbs.twimg.com/profile_banners/818649862967177216/1514915839,http://abs.twimg.com/images/themes/theme1/bg.png,http://pbs.twimg.com/profile_images/818887155338674176/CBrdC3Ts_normal.jpg
818649862967177216,1042937931273564160,2018-09-21T00:45:54Z,DeniseforAR,I’ve held meet-&amp;-greets across Dist. 84. Many in rural parts of Washington County didn’t even know they had a state representative. Nearly every single voter I’ve talked to feels you have gone too far &amp; took away local control with Act 562. You simply stopped listening #Extremism https://t.co/PgZrm8Sl4d,Twitter for iPhone,288,,,,TRUE,FALSE,62,11,Extremism,,twitter.com/CollinsARK/sta…,https://t.co/PgZrm8Sl4d,https://twitter.com/CollinsARK/status/1042893140175347712,,,,,,,,,,,en,1042893140175347712,"You've said Collins/me, @ARGOP &amp; #arleg are extreme &amp; not your #arpx many times-- Confirming you mean extremely consevative, ie bad in your view, policies (you cite education, taxes, healthcare, Public Safety, etc). Making sure I understand correctly thank you. https://t.co/IMe2XmkOmP",2018-09-20T21:47:55Z,Twitter for Android,5,1,108117069,CollinsARK,Charlie Collins,5142,3624,23413,"Washington County, Arkansas",Arkansas,FALSE,,,,,,,,,,,,,,,,,,,,,,|,|,|||||||,https://twitter.com/DeniseforAR/status/1042937931273564160,Denise Garner,"Arkansas, USA","Retired Oncology Nurse, nonprofit founder, mother & grandma. Representative for Arkansas District 84. #Denisefor84",https://t.co/1hsAOCNvfd,FALSE,1844,725,27,764,3386,2017-01-10T02:45:11Z,FALSE,https://t.co/1hsAOCNvfd,http://denisegarner.com,en,https://pbs.twimg.com/profile_banners/818649862967177216/1514915839,http://abs.twimg.com/images/themes/theme1/bg.png,http://pbs.twimg.com/profile_images/818887155338674176/CBrdC3Ts_normal.jpg
818649862967177216,1042598859065753600,2018-09-20T02:18:33Z,DeniseforAR,I just love my campaign walkers &amp; postcard writers. Together we are going to win this race &amp; prove to the #arleg that extremism has no place in Arkansas #arpx 💙💙💙 https://t.co/Yoie1cws84,Twitter for iPhone,170,,,,FALSE,FALSE,56,9,arleg|arpx,,,,,http://pbs.twimg.com/media/DngOIlfU4AAhEqm.jpg,https://t.co/Yoie1cws84,https://twitter.com/DeniseforAR/status/1042598859065753600/photo/1,photo,http://pbs.twimg.com/media/DngOIlfU4AAhEqm.jpg,https://t.co/Yoie1cws84,https://twitter.com/DeniseforAR/status/1042598859065753600/photo/1,,,,en,,,,,,,,,,,,,,,,,,,,,,,,,,,,,,,,,,,,,|,|,|||||||,https://twitter.com/DeniseforAR/status/1042598859065753600,Denise Garner,"Arkansas, USA","Retired Oncology Nurse, nonprofit founder, mother & grandma. Representative for Arkansas District 84. #Denisefor84",https://t.co/1hsAOCNvfd,FALSE,1844,725,27,764,3386,2017-01-10T02:45:11Z,FALSE,https://t.co/1hsAOCNvfd,http://denisegarner.com,en,https://pbs.twimg.com/profile_banners/818649862967177216/1514915839,http://abs.twimg.com/images/themes/theme1/bg.png,http://pbs.twimg.com/profile_images/818887155338674176/CBrdC3Ts_normal.jpg
818649862967177216,1041518471463546880,2018-09-17T02:45:28Z,DeniseforAR,Northwest Arkansas @MomsDemand members are volunteering around the clock to get Gun Sense Candidate @DeniseforAR elected! #arleg https://t.co/emOwq0hokD,Twitter for iPhone,140,,,,FALSE,TRUE,0,20,,,,,,,,,,,,,,455809758|1017637447|818649862967177216,evesuzanne|MomsDemand|DeniseforAR,en,,,,,,,,,,,,,,,,1041493343216263168,Northwest Arkansas @MomsDemand members are volunteering around the clock to get Gun Sense Candidate @DeniseforAR elected! #arleg https://t.co/emOwq0hokD,2018-09-17T01:05:37Z,Twitter for iPhone,74,20,455809758,evesuzanne,eve from Arkansas,3727,4911,17689,"Arkansas, USA","mom of two kids, feminist, wife. Arkansas chapter leader @momsdemand (All views are my own.)",FALSE,,,,,,,|,|,|||||||,https://twitter.com/DeniseforAR/status/1041518471463546880,Denise Garner,"Arkansas, USA","Retired Oncology Nurse, nonprofit founder, mother & grandma. Representative for Arkansas District 84. #Denisefor84",https://t.co/1hsAOCNvfd,FALSE,1844,725,27,764,3386,2017-01-10T02:45:11Z,FALSE,https://t.co/1hsAOCNvfd,http://denisegarner.com,en,https://pbs.twimg.com/profile_banners/818649862967177216/1514915839,http://abs.twimg.com/images/themes/theme1/bg.png,http://pbs.twimg.com/profile_images/818887155338674176/CBrdC3Ts_normal.jpg
818649862967177216,1041492428778287106,2018-09-17T01:01:59Z,DeniseforAR,What did you do with your Sunday afternoon? We wrote hundreds of postcards for our local @MomsDemand #GunSenseCandidate. We’ve had it with our current rep and plan to #ThrowHimOut. @DeniseforAR https://t.co/72Oqu1vfq1,Twitter for iPhone,139,,,,FALSE,TRUE,0,36,GunSenseCandidate,,,,,,,,,,,,,811307321712410628|1017637447,PhDandPearls|MomsDemand,en,,,,,,,,,,,,,,,,1041476357736161280,What did you do with your Sunday afternoon? We wrote hundreds of postcards for our local @MomsDemand #GunSenseCandidate. We’ve had it with our current rep and plan to #ThrowHimOut. @DeniseforAR https://t.co/72Oqu1vfq1,2018-09-16T23:58:08Z,Twitter for iPhone,195,36,811307321712410628,PhDandPearls,"Johanna Thomas, PhD, LMSW",1334,1667,8790,"Arkansas, USA","Arkansas Social Worker, educator, and local group leader with @MomsDemand. All opinions are my own.",FALSE,,,,,,,|,|,|||||||,https://twitter.com/DeniseforAR/status/1041492428778287106,Denise Garner,"Arkansas, USA","Retired Oncology Nurse, nonprofit founder, mother & grandma. Representative for Arkansas District 84. #Denisefor84",https://t.co/1hsAOCNvfd,FALSE,1844,725,27,764,3386,2017-01-10T02:45:11Z,FALSE,https://t.co/1hsAOCNvfd,http://denisegarner.com,en,https://pbs.twimg.com/profile_banners/818649862967177216/1514915839,http://abs.twimg.com/images/themes/theme1/bg.png,http://pbs.twimg.com/profile_images/818887155338674176/CBrdC3Ts_normal.jpg
818649862967177216,1041492346217615361,2018-09-17T01:01:39Z,DeniseforAR,"Hundreds of postcards written today for @MomsDemand #GunSenseCandidates @DeniseforAR. It’s crunch time!! Get out there and knock doors, make phone calls and write postcards. Our candidates need us. #SorryCharlie #ExpectUs https://t.co/fiUPgvWYvw",Twitter for iPhone,140,,,,FALSE,TRUE,0,2,GunSenseCandidates,,,,,,,,,,,,,811307321712410628|1017637447|818649862967177216,PhDandPearls|MomsDemand|DeniseforAR,en,,,,,,,,,,,,,,,,1041475951610286086,"Hundreds of postcards written today for @MomsDemand #GunSenseCandidates @DeniseforAR. It’s crunch time!! Get out there and knock doors, make phone calls and write postcards. Our candidates need us. #SorryCharlie #ExpectUs https://t.co/fiUPgvWYvw",2018-09-16T23:56:31Z,Twitter for iPhone,28,2,811307321712410628,PhDandPearls,"Johanna Thomas, PhD, LMSW",1334,1667,8790,"Arkansas, USA","Arkansas Social Worker, educator, and local group leader with @MomsDemand. All opinions are my own.",FALSE,,,,,,,|,|,|||||||,https://twitter.com/DeniseforAR/status/1041492346217615361,Denise Garner,"Arkansas, USA","Retired Oncology Nurse, nonprofit founder, mother & grandma. Representative for Arkansas District 84. #Denisefor84",https://t.co/1hsAOCNvfd,FALSE,1844,725,27,764,3386,2017-01-10T02:45:11Z,FALSE,https://t.co/1hsAOCNvfd,http://denisegarner.com,en,https://pbs.twimg.com/profile_banners/818649862967177216/1514915839,http://abs.twimg.com/images/themes/theme1/bg.png,http://pbs.twimg.com/profile_images/818887155338674176/CBrdC3Ts_normal.jpg
818649862967177216,1040764023443087361,2018-09-15T00:47:34Z,DeniseforAR,"And at the end of the month, @CapitolViewAR goes back to Northwest AR, where @CollinsARK is facing a challenge from @DeniseforAR in House District 84. #arpx #HD84

You’ll see each of them Sunday mornings at 8:30 on @KARK4News and @KNWAnews, right before @MeetThePress. https://t.co/rPOlnsP1kp",Twitter for iPhone,140,,,,FALSE,TRUE,0,6,,,,,,,,,,,,,,108860236|570544509|108117069,KARKMark|CapitolViewAR|CollinsARK,en,,,,,,,,,,,,,,,,1040762935218511872,"And at the end of the month, @CapitolViewAR goes back to Northwest AR, where @CollinsARK is facing a challenge from @DeniseforAR in House District 84. #arpx #HD84

You’ll see each of them Sunday mornings at 8:30 on @KARK4News and @KNWAnews, right before @MeetThePress. https://t.co/rPOlnsP1kp",2018-09-15T00:43:14Z,Twitter for iPhone,12,6,108860236,KARKMark,Mark Moseley,2314,372,16944,Little Rock,"@KARK4News @FOX16News Executive Producer | @CapitolViewAR | @FearlessFriday | #SilverStarNation || Texas Rangers fan. Opinions mine.",FALSE,,,,,,,|,|,|||||||,https://twitter.com/DeniseforAR/status/1040764023443087361,Denise Garner,"Arkansas, USA","Retired Oncology Nurse, nonprofit founder, mother & grandma. Representative for Arkansas District 84. #Denisefor84",https://t.co/1hsAOCNvfd,FALSE,1844,725,27,764,3386,2017-01-10T02:45:11Z,FALSE,https://t.co/1hsAOCNvfd,http://denisegarner.com,en,https://pbs.twimg.com/profile_banners/818649862967177216/1514915839,http://abs.twimg.com/images/themes/theme1/bg.png,http://pbs.twimg.com/profile_images/818887155338674176/CBrdC3Ts_normal.jpg
818649862967177216,1040723804098646017,2018-09-14T22:07:45Z,DeniseforAR,"Now that @AsaHutchinson has asked DFA to sue Ecclesia College, @CollinsARK will you finally join the effort to recover our public taxpayer money too? #arpx #arleg https://t.co/fmXYuY7FBi",Twitter for iPhone,186,,,,FALSE,FALSE,78,24,arpx|arleg,,m.nwaonline.com/news/2018/sep/…,https://t.co/fmXYuY7FBi,http://m.nwaonline.com/news/2018/sep/14/state-to-sue-for-funds-return-20180914/,,,,,,,,,269992801|108117069,AsaHutchinson|CollinsARK,en,,,,,,,,,,,,,,,,,,,,,,,,,,,,,,,,,,,,,|,|,|||||||,https://twitter.com/DeniseforAR/status/1040723804098646017,Denise Garner,"Arkansas, USA","Retired Oncology Nurse, nonprofit founder, mother & grandma. Representative for Arkansas District 84. #Denisefor84",https://t.co/1hsAOCNvfd,FALSE,1844,725,27,764,3386,2017-01-10T02:45:11Z,FALSE,https://t.co/1hsAOCNvfd,http://denisegarner.com,en,https://pbs.twimg.com/profile_banners/818649862967177216/1514915839,http://abs.twimg.com/images/themes/theme1/bg.png,http://pbs.twimg.com/profile_images/818887155338674176/CBrdC3Ts_normal.jpg
818649862967177216,1040471897937522688,2018-09-14T05:26:46Z,DeniseforAR,@janeite1900 @KNWAnews @KARK4News @CollinsARK It will be on Capital View 1 wk from this Sunday.,Twitter for Android,49,1040237896987492352,25945539,janeite1900,FALSE,FALSE,2,0,,,,,,,,,,,,,,25945539|108352504|20093858|108117069,janeite1900|KNWAnews|KARK4News|CollinsARK,en,,,,,,,,,,,,,,,,,,,,,,,,,,,,,,,,,,,,,|,|,|||||||,https://twitter.com/DeniseforAR/status/1040471897937522688,Denise Garner,"Arkansas, USA","Retired Oncology Nurse, nonprofit founder, mother & grandma. Representative for Arkansas District 84. #Denisefor84",https://t.co/1hsAOCNvfd,FALSE,1844,725,27,764,3386,2017-01-10T02:45:11Z,FALSE,https://t.co/1hsAOCNvfd,http://denisegarner.com,en,https://pbs.twimg.com/profile_banners/818649862967177216/1514915839,http://abs.twimg.com/images/themes/theme1/bg.png,http://pbs.twimg.com/profile_images/818887155338674176/CBrdC3Ts_normal.jpg
818649862967177216,1040464784867635200,2018-09-14T04:58:30Z,DeniseforAR,"What does it say about the current state of the @GOP that they’re flying @VP Mike Pence to Arkansas to rally the base against @clarketucker, who just wants everybody to have health care? It’s not a GOTV rally. It’s a take-health-care-from-the-poor-and-sick rally.",Twitter for Android,140,,,,FALSE,TRUE,0,47,,,,,,,,,,,,,,49816804|11134252|818910970567344128,BobbyHoward63|GOP|VP,en,,,,,,,,,,,,,,,,1040372938858483712,"What does it say about the current state of the @GOP that they’re flying @VP Mike Pence to Arkansas to rally the base against @clarketucker, who just wants everybody to have health care? It’s not a GOTV rally. It’s a take-health-care-from-the-poor-and-sick rally.",2018-09-13T22:53:32Z,Twitter for iPhone,92,47,49816804,BobbyHoward63,Bobby Howard 🤷🏻‍♂️,1043,488,19520,"Fayetteville, Arkansas","Fayetteville, AR #WPS // Philosophy, Theology & Politics // Views expressed here my own",FALSE,,,,,,,|,|,|||||||,https://twitter.com/DeniseforAR/status/1040464784867635200,Denise Garner,"Arkansas, USA","Retired Oncology Nurse, nonprofit founder, mother & grandma. Representative for Arkansas District 84. #Denisefor84",https://t.co/1hsAOCNvfd,FALSE,1844,725,27,764,3386,2017-01-10T02:45:11Z,FALSE,https://t.co/1hsAOCNvfd,http://denisegarner.com,en,https://pbs.twimg.com/profile_banners/818649862967177216/1514915839,http://abs.twimg.com/images/themes/theme1/bg.png,http://pbs.twimg.com/profile_images/818887155338674176/CBrdC3Ts_normal.jpg
818649862967177216,1040303600679870464,2018-09-13T18:18:00Z,DeniseforAR,@BlancoBenicio @KNWAnews @KARK4News @CollinsARK Guns in public places.,Twitter for Android,22,1040258076014665728,987845365,BlancoBenicio,FALSE,FALSE,0,0,,,,,,,,,,,,,,987845365|108352504|20093858|108117069,BlancoBenicio|KNWAnews|KARK4News|CollinsARK,en,,,,,,,,,,,,,,,,,,,,,,,,,,,,,,,,,,,,,|,|,|||||||,https://twitter.com/DeniseforAR/status/1040303600679870464,Denise Garner,"Arkansas, USA","Retired Oncology Nurse, nonprofit founder, mother & grandma. Representative for Arkansas District 84. #Denisefor84",https://t.co/1hsAOCNvfd,FALSE,1844,725,27,764,3386,2017-01-10T02:45:11Z,FALSE,https://t.co/1hsAOCNvfd,http://denisegarner.com,en,https://pbs.twimg.com/profile_banners/818649862967177216/1514915839,http://abs.twimg.com/images/themes/theme1/bg.png,http://pbs.twimg.com/profile_images/818887155338674176/CBrdC3Ts_normal.jpg
818649862967177216,1040072575328677889,2018-09-13T03:00:00Z,DeniseforAR,@DeniseforAR @KNWAnews @KARK4News @CollinsARK We are behind you Denise!! You are awesome!! Thank you for fighting the battle!!,Twitter for Android,140,,,,FALSE,TRUE,0,2,,,,,,,,,,,,,,759021667498627072|818649862967177216|108352504|20093858|108117069,soul2shine2|DeniseforAR|KNWAnews|KARK4News|CollinsARK,en,,,,,,,,,,,,,,,,1040068570372288517,@DeniseforAR @KNWAnews @KARK4News @CollinsARK We are behind you Denise!! You are awesome!! Thank you for fighting the battle!!,2018-09-13T02:44:05Z,Twitter for iPhone,9,2,759021667498627072,soul2shine2,Acme Co,188,392,6223,United States,I live in a giant red sea on a tiny blue island where I ride my donkey and throw coconuts at elephants all day. We are a product of our values.,FALSE,,,,,,,|,|,|||||||,https://twitter.com/DeniseforAR/status/1040072575328677889,Denise Garner,"Arkansas, USA","Retired Oncology Nurse, nonprofit founder, mother & grandma. Representative for Arkansas District 84. #Denisefor84",https://t.co/1hsAOCNvfd,FALSE,1844,725,27,764,3386,2017-01-10T02:45:11Z,FALSE,https://t.co/1hsAOCNvfd,http://denisegarner.com,en,https://pbs.twimg.com/profile_banners/818649862967177216/1514915839,http://abs.twimg.com/images/themes/theme1/bg.png,http://pbs.twimg.com/profile_images/818887155338674176/CBrdC3Ts_normal.jpg
818649862967177216,1040039095504982023,2018-09-13T00:46:58Z,DeniseforAR,"Thank you @KNWAnews @KARK4News for interviewing &amp; asking us questions.

We talked about @CollinsARK taking away local control, not listening to stakeholders. 

Dist. 84 is ready for change—for common sense gun safety legislation &amp; for a leader to protect healthcare of Arkansans https://t.co/3jdYS9R60Z",Twitter for iPhone,286,,,,FALSE,FALSE,74,21,,,,,,http://pbs.twimg.com/media/Dm72CrwU8AEAQUB.jpg,https://t.co/3jdYS9R60Z,https://twitter.com/DeniseforAR/status/1040039095504982023/photo/1,photo,http://pbs.twimg.com/media/Dm72CrwU8AEAQUB.jpg,https://t.co/3jdYS9R60Z,https://twitter.com/DeniseforAR/status/1040039095504982023/photo/1,,108352504|20093858|108117069,KNWAnews|KARK4News|CollinsARK,en,,,,,,,,,,,,,,,,,,,,,,,,,,,,,,,,,,,,,|,|,|||||||,https://twitter.com/DeniseforAR/status/1040039095504982023,Denise Garner,"Arkansas, USA","Retired Oncology Nurse, nonprofit founder, mother & grandma. Representative for Arkansas District 84. #Denisefor84",https://t.co/1hsAOCNvfd,FALSE,1844,725,27,764,3386,2017-01-10T02:45:11Z,FALSE,https://t.co/1hsAOCNvfd,http://denisegarner.com,en,https://pbs.twimg.com/profile_banners/818649862967177216/1514915839,http://abs.twimg.com/images/themes/theme1/bg.png,http://pbs.twimg.com/profile_images/818887155338674176/CBrdC3Ts_normal.jpg
818649862967177216,1040025169413201921,2018-09-12T23:51:37Z,DeniseforAR,@cupcakesarenice @CollinsARK I am appalled we would kick people off of their healthcare. The mandatory reporting requirements online is something we need to fix immediately! We have set up needless hurdles to families in need of healthcare. Why?! We are failing these families.,Twitter for iPhone,248,1040002917007339520,22165125,cupcakesarenice,FALSE,FALSE,7,0,,,,,,,,,,,,,,22165125|108117069,cupcakesarenice|CollinsARK,en,,,,,,,,,,,,,,,,,,,,,,,,,,,,,,,,,,,,,|,|,|||||||,https://twitter.com/DeniseforAR/status/1040025169413201921,Denise Garner,"Arkansas, USA","Retired Oncology Nurse, nonprofit founder, mother & grandma. Representative for Arkansas District 84. #Denisefor84",https://t.co/1hsAOCNvfd,FALSE,1844,725,27,764,3386,2017-01-10T02:45:11Z,FALSE,https://t.co/1hsAOCNvfd,http://denisegarner.com,en,https://pbs.twimg.com/profile_banners/818649862967177216/1514915839,http://abs.twimg.com/images/themes/theme1/bg.png,http://pbs.twimg.com/profile_images/818887155338674176/CBrdC3Ts_normal.jpg
818649862967177216,1040006522338766860,2018-09-12T22:37:31Z,DeniseforAR,"...@DeniseforAR (D) District 84 Oct. 1 at noon
@meganforAR District 89 Oct. 4 at noon
Candidates will speak in Student Center 108A unless otherwise noted",Twitter for iPhone,140,,,,FALSE,TRUE,0,3,,,,,,,,,,,,,,41796216|818649862967177216|960128411183312896,NWACC|DeniseforAR|meganforAR,en,,,,,,,,,,,,,,,,1040003094694846466,"...@DeniseforAR (D) District 84 Oct. 1 at noon
@meganforAR District 89 Oct. 4 at noon
Candidates will speak in Student Center 108A unless otherwise noted",2018-09-12T22:23:54Z,Twitter Web Client,8,3,41796216,NWACC,NorthWest Arkansas Community College,3518,299,6634,"Bentonville, Ark.",There's a place for you here! Connect with us! #NWACC #Education #NWA,FALSE,,,,,,,|,|,|||||||,https://twitter.com/DeniseforAR/status/1040006522338766860,Denise Garner,"Arkansas, USA","Retired Oncology Nurse, nonprofit founder, mother & grandma. Representative for Arkansas District 84. #Denisefor84",https://t.co/1hsAOCNvfd,FALSE,1844,725,27,764,3386,2017-01-10T02:45:11Z,FALSE,https://t.co/1hsAOCNvfd,http://denisegarner.com,en,https://pbs.twimg.com/profile_banners/818649862967177216/1514915839,http://abs.twimg.com/images/themes/theme1/bg.png,http://pbs.twimg.com/profile_images/818887155338674176/CBrdC3Ts_normal.jpg
818649862967177216,1039966144625602560,2018-09-12T19:57:05Z,DeniseforAR,"I never planned to run for office. After my son Jordan was shot and killed, my life completely changed. This is my story -- please share it far and wide, and join me on this journey. 

-- With Love, 

Lucy https://t.co/f5Ej8fKQxO",Twitter for iPhone,139,,,,FALSE,TRUE,0,14725,,,,,,,,,,,,,,,,en,,,,,,,,,,,,,,,,1039930734352494592,"I never planned to run for office. After my son Jordan was shot and killed, my life completely changed. This is my story -- please share it far and wide, and join me on this journey. 

-- With Love, 

Lucy https://t.co/f5Ej8fKQxO",2018-09-12T17:36:22Z,Twitter Web Client,34053,14725,947956236804337664,lucymcbath,Lucy McBath,84760,395,1021,"Georgia, USA",Mother of Jordan Davis - young man who was shot and killed in the national Loud Music Shooting. Congresswoman for Georgia’s Sixth Congressional District.,TRUE,,,,,,,|,|,|||||||,https://twitter.com/DeniseforAR/status/1039966144625602560,Denise Garner,"Arkansas, USA","Retired Oncology Nurse, nonprofit founder, mother & grandma. Representative for Arkansas District 84. #Denisefor84",https://t.co/1hsAOCNvfd,FALSE,1844,725,27,764,3386,2017-01-10T02:45:11Z,FALSE,https://t.co/1hsAOCNvfd,http://denisegarner.com,en,https://pbs.twimg.com/profile_banners/818649862967177216/1514915839,http://abs.twimg.com/images/themes/theme1/bg.png,http://pbs.twimg.com/profile_images/818887155338674176/CBrdC3Ts_normal.jpg
